"Frequency","Word","Sentence"
2,reunido,"A las once de la mañana, todo el colegio parecía estar reunido alrededor del campo de quidditch."
2,destruido,"La casa estaba casi destruida, pero lo he sacado antes de que los muggles comenzaran a aparecer."
2,topo,"Por las ventanas de arriba veían a Hagrid descongelando las escobas en el campo de quidditch, enfund"
2,amistoso,"—preguntó Harry, tratando de mantener el tono amistoso."
2,trato,"Diez años antes, había una gran cantidad de retratos de lo que parecía una gran pelota rosada con go"
2,toque,"Tío Vernon dijo en tono cortante:  —No toques nada que él te dé, Dudley."
2,galería,"—señaló Harry a los otros y, aterrados, comenzaron a atravesar una larga galería llena de armaduras."
2,muchísima,"—Muchísima —dijo Harry, dando un mordisco a una empanada de calabaza."
2,grandioso,"Había unos grandiosos forrados en piel, otros del tamaño de un sello, con tapas de seda, otros lleno"
2,peluca,Harry decía a menudo que Dudley parecía un cerdo con peluca.
2,curar,"—Ahora escucha esto, chico —gruñó—: acepto que hay algo extraño en ti, probablemente nada que no hub"
2,forzado,Harry notó que las sonrisas de los otros profesores se habían vuelto algo forzadas.
2,estirar él,"La señora Dursley era delgada, rubia y tenía un cuello casi el doble de largo de lo habitual, lo que"
2,agreste,"En aquel momento, el paisaje que se veía por la ventanilla se hacía más agreste."
2,prestado,"Hagrid  Harry cogió prestada la pluma de Ron y contestó: «Sí, gracias, nos veremos más tarde», en la"
2,coleccionar,"Las ranas de chocolate llevan cromos, ya sabes, para coleccionar, de brujas y magos famosos."
2,infracción,"Mientras estéis en Hogwarts, vuestros triunfos conseguirán que vuestra casa gane puntos, mientras qu"
2,moda,Supuso que debía de ser una moda nueva.
2,pudin,"Nunca había visto tantas cosas que le gustara comer sobre una mesa: carne asada, pollo asado, chulet"
2,enfado,"—dijo Snape con enfado, haciendo desaparecer la poción con un movimiento de su varita—."
2,púa,"Supongo que has añadido las púas de erizo antes de sacar el caldero del fuego, ¿no."
2,escabullir,"Lo hizo funcionar una vez y todas las luces de la calle se encendieron, de manera que Privet Drive s"
2,asada,"Nunca había visto tantas cosas que le gustara comer sobre una mesa: carne asada, pollo asado, chulet"
2,botecito,"—gritó Hagrid, señalando a una flota de botecitos alineados en el agua, al lado de la orilla."
2,deberéis,"El banquete de comienzo de año se celebrará dentro de poco, pero antes de que ocupéis vuestros lugar"
2,id,Id directamente a la buhonera y enviad a Hedwig a Dumbledore.
2,misteriosamente,Tío Vernon y tía Petunia se miraban misteriosamente.
2,enséñano,"Y todo el colegio vociferó:  Hogwarts, Hogwarts, Hogwarts,  enséñanos algo, por favor."
2,blando,"Pero, como no lo hizo, continuó hablando."
2,caoba,"—Su padre, por otra parte, prefirió una varita de caoba."
2,escuchadme,"Ahora, escuchadme los tres, os estáis metiendo en cosas que no os conciernen y eso es peligroso."
2,genial,—¡Genial.
2,bravo,"¡Bravo, Dudley."
2,sobrepasar,"Ronald Weasley, que siempre ha sido sobrepasado por sus hermanos, se ve solo y el mejor de todos ell"
2,retirar,Se inclinó y retiró su varita de la nariz del trol.
2,aplicación,"Considerado por casi todo el mundo como el más grande mago del tiempo presente, Dumbledore es partic"
2,apesadumbrado,"Dumbledore asintió con la cabeza, apesadumbrado."
2,queridir,"—Querido, no has contado el regalo de tía Marge."
2,murciélago,"Escaparates repletos de barriles de bazos de murciélago y ojos de anguila, tambaleantes montones de "
2,conservar,Separó uno y dijo:  —Mi madre siempre se olvida de que no me gusta la carne en conserva.
2,firmado,"Pero, por desgracia, hacía falta un permiso especial, firmado por un profesor, para mirar alguno de "
2,manojo,"El abrigo de Hagrid parecía hecho sólo de bolsillos, con contenidos de todo tipo: manojos de llaves,"
2,hacer yo,"—No estoy tratando de hacerme el valiente, ni nada por el estilo, al decir el nombre —dijo Harry—."
2,fríamente,—Eres mucho más valiente ahora que has vuelto a tierra firme y tienes a tus amiguitos —dijo fríament
2,raíl,Se inclinaba hacia abajo y había unos raíles en el suelo.
2,contramaleficio,"Todos empezaron a reírse, salvo Hermione, que se puso de pie e hizo el contramaleficio."
2,vosotros,"—Ahora, vosotros dos."
2,velada,"Ron había pasado toda la velada dándole consejos del tipo de: «Si trata de maldecirte, será mejor qu"
2,suceder él,"Flint casi mata al buscador de Gryffindor, cosa que podría sucederle a cualquiera, estoy seguro, así"
2,estropeado,—No sé cómo los muggles se las arreglan sin magia —comentó mientras subían por una escalera mecánica
2,dar yo,"—No debería enfadarme —dijo con pesar—, pero a lo mejor no ha funcionado."
2,creeréis,"—¿No creeréis que voy a quedarme aquí, esperando a que Filch me atrape."
2,ésa,—Debes tener cuidado con ésas —lo previno Ron—.
2,trabajado,"» Contenía una flauta de madera, toscamente trabajada."
2,escuchar él,Harry intentó no escucharla.
2,inusual,Está inusualmente brillante.
2,borracho,"Bloques de helado de todos los sabores que uno se pudiera imaginar, pasteles de manzana, tartas de m"
2,brasa,"Harry observó al duende que tenía a la derecha, que pesaba unos rubíes tan grandes como brasas."
2,tapar él,Draco Malfoy y sus amigos Crabbe y Goyle rieron tapándose la boca.
2,organizado,"Al fin y al cabo, para una mente bien organizada, la muerte no es más que la siguiente gran aventura"
2,muchedumbre,Hagrid era tan corpulento que separaba fácilmente a la muchedumbre.
2,desplomar él,"no hay comida —logró decir, antes de desplomarse en una silla."
2,salvar tú,"Un bezoar es una piedra sacada del estómago de una cabra, y sirve para salvarte de la mayor parte de"
2,genio,"El sombrero parecía exigir mucho, y Harry no se sentía valiente ni ingenioso ni nada de eso, por el "
2,iréis,"Tendréis clases con el resto de la casa que os toque, dormiréis en el dormitorio de vuestra casa y p"
2,animado,"Si había algo que desagradaba a los Dursley aún más que las preguntas que Harry hacía, era que habla"
2,coro,—Harry Potter —respondieron a coro.
2,repugnante,"Otra vez, tía Petunia había tratado de meterlo dentro de un repugnante jersey viejo de Dudley (marró"
2,concernir,"Ahora, escuchadme los tres, os estáis metiendo en cosas que no os conciernen y eso es peligroso."
2,visto,"Sabían que los Potter también tenían un hijo pequeño, pero nunca lo habían visto."
2,actualmente,"Harry dio la vuelta a la tarjeta y leyó:  Albus Dumbledore, actualmente director de Hogwarts."
2,quítate,"—Quítate de en medio —ordenó Ron, y le dio un golpe a Peeves."
2,míralo,Míralos a todos.
2,atentamente,"—Buen Dios —dijo el cantinero, mirando atentamente a Harry—."
2,barril,"Escaparates repletos de barriles de bazos de murciélago y ojos de anguila, tambaleantes montones de "
2,desmayar,—Creo que se ha desmayado —dijo Ron a Harry.
2,estremecir,Los Dursley se estremecían al pensar qué dirían los vecinos si los Potter apareciesen por la acera.
2,saco,"El saco de boxeo favorito de Dudley era Harry, pero no podía atraparlo muy a menudo."
2,pum,¡PUM.
2,gustar él,"Miraba con expresión radiante a los alumnos, con los brazos muy abiertos, como si nada pudiera gusta"
2,buscarte,Buscarte a ti.
2,martes,Cuando el señor y la señora Dursley se despertaron el sombrío y gris martes en el que nuestra histor
2,sensato,"—Mi querida profesora, estoy seguro de que una persona sensata como usted puede llamarlo por su nomb"
2,cascarón,—Pero ¿qué vas a hacer cuando salga del cascarón.
2,traicionar,Y Neville jugará al quidditch en el equipo de Inglaterra antes de que Hagrid traicione a Dumbledore.
2,burbuja,"Le recordaron los palitos de plástico con los que los niños muggles hacían burbujas, sólo que éstos "
2,bizcocho,"Bloques de helado de todos los sabores que uno se pudiera imaginar, pasteles de manzana, tartas de m"
2,impresionar,"Harry ya se había acostumbrado, pero la primera mañana se impresionó un poco cuando unos cien búhos "
2,grifo,"—susurró Ron, empujando a Harry detrás de un gran grifo de piedra."
2,inseguro,—preguntó con aire inseguro a Percy.
2,conocerte,conocerte.
2,centenar,"Un centenar de duendes estaban sentados en altos taburetes, detrás de un largo mostrador, escribiend"
2,demonios,"—Si nos atrapan por vuestra culpa, no descansaré hasta aprender esa Maldición de los Demonios, de la"
2,entender él,"Los Dursley hablaban a menudo sobre Harry de aquella manera, como si no estuviera allí, o más bien c"
2,mango,Se inclinó hacia delante y apuntó el mango de la escoba hacia abajo.
2,saludar él,"—Espero que nos veamos pronto, profesora McGonagall —dijo Dumbledore, saludándola con una inclinació"
2,castellano,Título original: Harry Potter and the Philosopher’s Stone  Traducción: Alicia Dellepiane Rawson  Tra
2,tapiz,"Estaba tan dormido que ni se sorprendió al ver que la gente de los retratos, a lo largo de los pasil"
2,riéndose,"Cuando tía Petunia y Dudley salieron corriendo, cubriéndose la cara con las manos, tío Vernon cerró "
2,quedartar,"—Puedes quedarte con ella —dijo Harry, riendo ante el placer de Ron—."
2,tejer,Hagrid ocupó dos asientos y comenzó a tejer lo que parecía una carpa de circo color amarillo canario
2,cabra,"Un bezoar es una piedra sacada del estómago de una cabra, y sirve para salvarte de la mayor parte de"
2,emporio,»  Un suave ulular llegaba de una tienda oscura que tenía un rótulo que decía: «Emporio del Búho.
2,derrota,"Considerado por casi todo el mundo como el más grande mago del tiempo presente, Dumbledore es partic"
2,tumulto,Se produjo un tumulto.
2,rendir él,Pero tío Vernon no iba a rendirse sin luchar.
2,expulsar él,"Iban a expulsarlo, lo sabía."
2,pretender,—¿Qué pretenden teniendo una cosa así encerrada en un colegio.
2,convencido,"No les creyó cuando dijeron que estaban perdidos, estaba convencido de que querían entrar a propósit"
2,repartir,Era como si Snape empezara a repartir golosinas.
2,eres,"Un nombre vulgar y horrible, si quieres mi opinión."
2,espectador,"Telespectadores de lugares tan apartados como Kent, Yorkshire y Dundee han telefoneado para decirme "
2,tembloroso,Harry la abrió con dedos temblorosos.
2,anotar,"Cuando Angelina anotó un punto, Harry hizo un par de rizos para aflojar la tensión y volvió a vigila"
2,deberíais,"Y vosotros dos deberíais cambiaros ya, vamos a llegar pronto."
2,busca,"Estaba muy ocupado revolviendo en su capa, buscando algo, pero pareció darse cuenta de que lo observ"
2,dejar yo,—Podéis dejarme aquí —sugirió esperanzado Harry.
2,escudo,"Con las manos temblorosas, Harry le dio la vuelta al sobre y vio un sello de lacre púrpura con un es"
2,olfatear,"Harry olfateó y un aroma especial llegó a su nariz, una mezcla de calcetines sucios y baño público q"
2,enroscar,"—Oh, me alegro mucho de saber cómo se llama, es de gran ayuda —gruñó Ron, tratando de evitar que la "
2,decírselo,—He estado a punto de decírselo a tu hermano —contestó enfadada Hermione—.
2,novato,¡Los horribles novatos.
2,ráfaga,"A Harry le escocían los ojos por las ráfagas de aire frío, pero los mantuvo muy abiertos."
2,retumbar,Una voz retumbó en el tren.
2,grindelwald,"Considerado por casi todo el mundo como el más grande mago del tiempo presente, Dumbledore es partic"
2,dorso,El gigante tomó un sorbo de té y se secó la boca con el dorso de la mano.
2,halcón,Tenía el pelo corto y canoso y ojos amarillos como los de un halcón.
2,espantoso,"—Oh, sí —dijo el señor Dursley, con una espantosa sensación de abatimiento—."
2,romper él,—Voy a romperles la cabeza —dijo Hagrid—.
2,cintura,Tío Vernon cogió a Harry por la cintura y lo arrojó al recibidor.
2,sollozó,—sollozó Hagrid mientras Harry y Hermione cubrían la jaula con la capa invisible y se metían dentro 
2,atizador,"El gigante volvió a sentarse en el sofá, que se hundió bajo su peso, y comenzó a sacar toda clase de"
2,posar,Tamborileó con los dedos sobre el volante y su mirada se posó en unos extraños que estaban cerca de 
2,espectacular,El salón estaba espectacular.
2,haciéndolo,"y la última vez que Dudley le pegó, ¿no se vengó de él, aunque sin darse cuenta de que estaba hacién"
2,invadir,El temor lo invadió.
2,rezongó,—rezongó.
2,vencer,"Por otra parte, el rostro burlón de Malfoy se le aparecía en la oscuridad, y aquélla era la gran opo"
2,conmovido,"—He tenido que dejar que sucediera —dijo Ron, conmovido—."
2,cuidadoso,"—Nunca se es demasiado cuidadoso —dijo Hagrid, tocando su ballesta—."
2,vidriera,"Estaba oscuro y hacía frío, y había vidrieras iluminadas a lo largo de las paredes."
2,atajo,"Filch debía de conocer un atajo para llegar a donde él estaba, porque el murmullo de su voz se acerc"
2,pottermore,Título original: Harry Potter and the Philosopher’s Stone  Traducción: Alicia Dellepiane Rawson  Tra
2,casillero,"Hermione gritó, pero se quedó en su casillero."
2,agitado,"Hasta pueden estar siguiéndonos —murmuró tío Vernon, agitado."
2,hirveir,"No espero que lleguéis a entender la belleza de un caldero hirviendo suavemente, con sus vapores rel"
2,inconsciente,"Todavía está inconsciente, pero la señora Pomfrey dice que se pondrá bien."
2,timbre,"Justo entonces, sonó el timbre de la puerta."
2,knut,—Dale cinco knuts —dijo soñoliento Hagrid.
2,podrías,—¿Podrías llevarme hasta allí.
2,despacio,¿Y podemos ir un poco más despacio.
2,pasaje,"Un segundo más tarde estaban contemplando un pasaje abovedado lo bastante grande hasta para Hagrid, "
2,absurdo,"El profesor Quirrell, con su absurdo turbante, conversaba con un profesor de grasiento pelo negro, n"
2,anaranjado,"Lo hizo funcionar una vez y todas las luces de la calle se encendieron, de manera que Privet Drive s"
2,invernadero,"Había gritado, había pegado a su padre con el bastón de Smeltings, se había puesto malo a propósito,"
2,mordedura,"A la mañana siguiente, en la clase de Defensa Contra las Artes Oscuras, mientras copiaban las difere"
2,príncipe,"Su turbante, les dijo, era un regalo de un príncipe africano como agradecimiento por haberlo liberad"
2,delegado,Bill era delegado de clase y Charlie era capitán de quidditch.
2,conocías,—¿Conocías ya a Malfoy.
2,llanto,Dudley suspendió su fingido llanto de inmediato.
2,polkiss,"—dijo tía Petunia en tono desesperado, y, un momento más tarde, el mejor amigo de Dudley, Piers Polk"
2,polvoriento,"» En el polvoriento escaparate, sobre un cojín de desteñido color púrpura, se veía una única varita."
2,discúlpeme,—Discúlpeme —dijo Harry a la mujer regordeta.
2,alineado,"—gritó Hagrid, señalando a una flota de botecitos alineados en el agua, al lado de la orilla."
2,cálmate,"—Cálmate, querido muchacho, estás un poco atrasado —dijo Dumbledore—."
2,gordito,"Nunca pensé que podían gustarte los gorditos llorones, Parvati."
2,fruncido,La señora Dursley bebió su té con los labios fruncidos.
2,insegura,"Y lo oyeron, un gruñido y las pisadas inseguras de unos pies gigantescos."
2,oponer,"Por supuesto, algunos se le opusieron y él los mató."
2,apoyado,Fang tenía la cabeza apoyada sobre la rodilla de Harry y babeaba sobre su túnica.
2,obvio,después de esta obvia y desagradable trampa.
2,guant,— Un par de guantes protectores (piel de dragón o semejante).
2,domingo,"• • •  La mañana del domingo, tío Vernon estaba sentado ante la mesa del desayuno, con aspecto de ca"
2,grunnings,"El señor Dursley era el director de una empresa llamada Grunnings, que fabricaba taladros."
2,despedir él,"A las ocho y media, el señor Dursley cogió su maletín, besó a la señora Dursley en la mejilla y trat"
2,misericordia,Murieron pidiéndome misericordia.
2,aquéllo,El señor Dursley se preguntó si aquélla era una conducta normal en un gato.
2,ajo,"El señor Dursley canturreaba mientras se ponía su corbata más sosa para ir al trabajo, y la señora D"
2,montado,"Añoraba el castillo, con sus pasadizos secretos y sus fantasmas; las clases (aunque quizá no a Snape"
2,dalar,—Dale cinco knuts —dijo soñoliento Hagrid.
2,inclinado,Lo que sucedió a continuación fue tan rápido que nadie supo cómo había pasado: Piers y Dudley estaba
2,evidentemente,"Tío Vernon estaba acostado en la puerta, en un saco de dormir, evidentemente para asegurarse de que "
2,cut,—El locutor se permitió una mueca irónica—.
2,giró,Giró su escoba para situarse frente a Malfoy en el aire.
2,hechizos,—Hechizos.
2,mantequilla,Hagrid casi tuvo que arrastrar a Harry para que dejara Hechizos y contrahechizos (encante a sus amig
2,leal,"Puedes pertenecer a Hufflepuff,  donde son justos y leales."
2,west,Harry había descubierto a Ron tratando de animar un póster de Dean en que aparecía el equipo de fútb
2,recordad,Recordad todo lo que os he dicho cuando estéis en el tren volviendo a casa mañana.
2,patear,Ronan pateó el suelo con nerviosismo.
2,terry,"—¡Boot, Terry."
2,mohosa,Tía Petunia halló unas pocas mantas mohosas en la otra habitación y preparó una cama para Dudley en 
2,trepar,"Los Dursley recibieron una carta amenazadora de la directora, diciéndoles que Harry andaba trepando "
2,suplicar,—Aunque sea un pedazo de tostada —suplicó Hermione.
2,costilla,"—Quita de en medio —dijo, golpeando a Harry en las costillas."
2,malignidad,Malfoy sonrió con malignidad.
2,espléndido,Harry nunca habría imaginado un lugar tan extraño y espléndido.
2,quebrantar,—¿Así que crees que es un premio por quebrantar las reglas.
2,enfrentar yo,"Si no lo hago, todos los Slytherins pensarán que tengo miedo de enfrentarme con Snape."
2,ibar,"¿Cómo no ibas a serlo, siendo lo que era mi condenada hermana."
2,panadería,"Estuvo de muy buen humor hasta la hora de la comida, cuando decidió estirar las piernas y dirigirse "
2,disculpar él,¡Ellos son los que tienen que disculparse.
2,morgana,"Vaya, me ha salido otra vez Morgana y ya la tengo repetida seis veces."
2,saltón,"Filch tenía una gata llamada Señora Norris, una criatura flacucha y de color arena, con ojos saltone"
2,miente,—Él miente.
2,precipitar,Al principio se precipitaron a través de un laberinto de retorcidos pasillos.
2,ronca,—Ajá —respondió Hagrid con voz ronca—.
2,desmayar él,Durante un momento pareció que iba a desmayarse.
2,gastado,Dudley y Harry compartieron una habitación con camas gemelas y sábanas húmedas y gastadas.
2,acera,Los Dursley se estremecían al pensar qué dirían los vecinos si los Potter apareciesen por la acera.
2,acónito,"—¿Cuál es la diferencia, Potter, entre acónito y luparia."
2,paralizado,"Harry, Malfoy y Fang permanecieron paralizados."
2,pérdida,Hagrid casi tuvo que arrastrar a Harry para que dejara Hechizos y contrahechizos (encante a sus amig
2,pequeñito,"—¡Mi pequeñito Dudley, no llores, mamá no dejará que él te estropee tu día especial."
2,soplar,La profesora McGonagall resopló enfadada.
2,registrar,La cámara que se registró había sido vaciada aquel mismo día.
2,pestillo,No habían dado más de una docena de pasos cuando se movió un pestillo y algo salió disparado de un a
2,mamáaaaaaa,—¡Mamáaaaaaa.
2,fosa,"De pronto, Harry se dio cuenta de que la cinta métrica, que en aquel momento lo medía entre las fosa"
2,comportar él,"No, estaba comportándose como un estúpido."
2,entrecortado,—dijo Harry con voz entrecortada.
2,pensar él,"Y pensándolo mejor, ni siquiera estaba seguro de que su sobrino se llamara Harry."
2,hechicero,Sacó la carta y leyó:    COLEGIO HOGWARTS  DE MAGIA Y HECHICERÍA  Director: Albus Dumbledore (Orden 
2,efe,¡No puede referirse a la gente que vive aquí.
2,extendido,"Ante eso, Hermione se puso de pie, con el brazo extendido hacia el techo de la mazmorra."
2,mudo,"La profesora McGonagall estaba casi muda de la impresión, y sus gafas centelleaban de furia."
2,aburrir,"En el desayuno del jueves, aburrió a todos con estúpidas notas sobre el vuelo que había encontrado e"
2,descontar,"—Cinco, querrás decir, una vez que se descuenten los de Hermione."
2,resplandor,"Lo hizo funcionar una vez y todas las luces de la calle se encendieron, de manera que Privet Drive s"
2,pendiente,"Neville estaba pendiente de cada palabra, desesperado por encontrar algo que lo ayudara más tarde a "
2,valiar,"No valía la pena preocupar a la señora Dursley, siempre se trastornaba mucho ante cualquier mención "
2,berrinche,"A las ocho y media, el señor Dursley cogió su maletín, besó a la señora Dursley en la mejilla y trat"
2,librería,"Pasaron ante librerías y tiendas de música, ante hamburgueserías y cines, pero ningún sitio donde pa"
2,babosa,"El abrigo de Hagrid parecía hecho sólo de bolsillos, con contenidos de todo tipo: manojos de llaves,"
2,taburet,"Un centenar de duendes estaban sentados en altos taburetes, detrás de un largo mostrador, escribiend"
2,malito,"Malitos, malitos, os agarrarán del cuellecito."
2,confundido,"Pero Wood era una persona, un muchacho corpulento de quinto año que salió de la clase de Flitwick co"
2,arriates,"Mientras Dudley no hacía otra cosa que mirarlo y comer helados, Harry limpió las ventanas, lavó el c"
2,grabado,"Entonces encontraron otra puerta doble, esta vez de plata, con unas palabras grabadas."
2,cruel,"Mientras Hagrid iba terminando la historia, vio otra vez la cegadora luz verde, con más claridad de "
2,desviar,"Lanzó una mirada a Harry y luego desvió la vista rápidamente hacia la ventanilla, como si no hubiera"
2,anoche,"Para Jessica, a quien le gustan las historias,  para Anne, a quien también le gustaban,  y para Di, "
2,rabillo,"Con el rabillo del ojo vio el estandarte brillando sobre la muchedumbre: «Potter, presidente."
2,burlona,Crabbe y Goyle lanzaron risitas burlonas.
2,temeroso,"todas las cosas raras que habían hecho que sus tíos se enfadaran con él habían sucedido cuando él, H"
2,águila,"Con las manos temblorosas, Harry le dio la vuelta al sobre y vio un sello de lacre púrpura con un es"
2,cogote,"—gritó tío Vernon, y, cogiendo a Harry y a Dudley por el cogote, los arrojó al recibidor y cerró la "
2,figurar,El problema era que costaba mucho buscar sin saber qué podía haber hecho Flamel para figurar en un l
2,rechazar,"Mientras Harry y Ron regresaban al castillo para cenar, con los bolsillos llenos del pétreo pastel q"
2,rozar,El gigante se escurrió hacia el interior de la cabaña agachándose para que su cabeza sólo rozara el 
2,relucir,"Copas, escudos, bandejas y estatuas, oro y plata reluciendo en la oscuridad."
2,enfocar,"Ante esas palabras, Hermione cogió los binoculares de Hagrid, pero en lugar de enfocar a Harry comen"
2,insignia,"Ya se había puesto la ondulante túnica negra de Hogwarts, y Harry vio que en el pecho tenía una insi"
2,pensativo,—preguntó Hermione con aire pensativo.
2,género,Harry cogió el género brillante y plateado.
2,avergonzado,Nunca me he sentido tan avergonzada de unos alumnos de Gryffindor.
2,bludgers,Esas dos son las bludgers.
2,venga,¡Venga.
2,bones,"Nadie a quien él hubiera decidido matar sobrevivió, nadie excepto tú, y eso que acabó con algunos de"
2,enfurecido,"Hagrid, enfurecido, contempló a Harry."
2,esforzar,Se esforzó por oír lo que decían.
2,recuperar él,"—dijo Harry, tratando de recuperarla."
2,soportar él,"bueno, creía que no podría soportarlo."
2,entra,Entraron en el pasaje.
2,trasladar,"En un solo viaje, Harry trasladó todas sus pertenencias desde la alacena a su nuevo dormitorio."
2,conejo,"Tal vez tenían que intentar sacar un conejo del sombrero, pensó Harry algo irreflexivamente, eso era"
2,luparia,"—¿Cuál es la diferencia, Potter, entre acónito y luparia."
2,brusquedad,"Después de unos minutos moviéndose entre el remolino de plumas de todos los colores, detectó una gra"
2,hambriento,"Le sirvió las salchichas a Harry, el cual estaba tan hambriento que pensó que nunca había probado al"
2,redondeado,Hermione señaló una botella redondeada del extremo derecho de la fila.
2,enderezar él,"Al segundo siguiente, Quirrell salió apresuradamente del aula, enderezándose el turbante."
2,mordisco,"—Muchísima —dijo Harry, dando un mordisco a una empanada de calabaza."
2,convencer él,"—Ron estará bien —dijo Harry, tratando de convencerse a sí mismo—."
2,terrorífico,"Pero no había nada terrorífico allí, sólo una mesa con siete botellas de formas diferentes puestas e"
2,instar,—lo instó Hermione—.
2,movero,—No debéis moveros mientras llevo a este chico a la enfermería.
2,of,"Para Jessica, a quien le gustan las historias,  para Anne, a quien también le gustaban,  y para Di, "
2,atrasado,Harry se sintió muy aliviado al descubrir que no estaba mucho más atrasado que los demás.
2,aferrado,"—¿No te viene a la memoria nadie que haya esperado muchos años para regresar al poder, que esté afer"
2,repaso,Hermione había comenzado ya a hacer horarios de repaso para Harry y Ron.
2,encontrar yo,"Si tienes cualquier problema con los Dursley, me mandas una carta con tu lechuza, ella sabrá encontr"
2,grandes,"Lo sé todo sobre ti, por supuesto, conseguí unos pocos libros extra para prepararme mejor y tú figur"
2,danés,"Los dejó entrar, tirando del collar de un imponente gran danés negro."
2,encaminar,"»  Cerca de las siete, Harry salió del castillo y se encaminó hacia el campo de quidditch."
2,suficientemente,"Comieron en el restaurante del zoológico, y cuando Dudley tuvo una rabieta porque su bocadillo no er"
2,utilízalo,Utilízalo bien.
