"Frequency","Word","Sentence"
1,parlotear,"El señor Dursley canturreaba mientras se ponía su corbata más sosa para ir al trabajo, y la señora D"
1,vine,—Vine a buscar al trol porque yo.
1,torcida,"Harry había oído a Fred y a George Weasley quejarse de las escobas del colegio, diciendo que algunas"
1,chisporrotear,Una pieza de cerdo asado chisporroteaba en el horno.
1,ignoraba,"Cuando Dumbledore me dijo que podía tener problemas para recogerte, no tenía ni idea de cuánto ignor"
1,abrasar,El sol ardiente le abrasaba la nuca.
1,resultaras,No me sorprendería que resultaras ser mejor jugador que Charlie Weasley.
1,merienda,"Mientras Harry y Ron regresaban al castillo para cenar, con los bolsillos llenos del pétreo pastel q"
1,barato,"Los Dursley compraron a Dudley y a Piers unos grandes helados de chocolate en la entrada, y luego, c"
1,hoyuelo,"A eso de las doce y media se produjo un traqueteo en el pasillo, y una mujer de cara sonriente, con "
1,rodeando tú,"Para ti, que nunca conociste a tu familia, es verlos rodeándote."
1,j,"Para Jessica, a quien le gustan las historias,  para Anne, a quien también le gustaban,  y para Di, "
1,pensár,¡Y todo el tiempo pensábamos que Snape sólo quería ser rico.
1,boxeo,"El saco de boxeo favorito de Dudley era Harry, pero no podía atraparlo muy a menudo."
1,dividido,Estaba dividida entre el horror de la idea de Harry vagando por el colegio tres noches seguidas («¡S
1,rabieta,"Comieron en el restaurante del zoológico, y cuando Dudley tuvo una rabieta porque su bocadillo no er"
1,acertijo,es un acertijo.
1,devolución,"Ni siquiera era socio de la biblioteca, así que nunca había recibido notas que le reclamaran la devo"
1,azar,Los demás se sentían muy felices de practicar el deporte favorito de Dudley: cazar a Harry.
1,reconoceriir,¿Reconocería una mordedura de dragón.
1,desembalar,"En aquel momento sonó el teléfono y tía Petunia fue a cogerlo, mientras Harry y tío Vernon miraban a"
1,lechero,"Veinticuatro cartas para Harry entraron en la casa, escondidas entre dos docenas de huevos que un mu"
1,semanal,"Las clases de Pociones se convirtieron en torturas semanales para Harry, por la forma en que lo trat"
1,disposición,"Hay talento, oh, vaya, sí, y una buena disposición para probarse a sí mismo, esto es muy interesante"
1,viridian,Hagrid casi tuvo que arrastrar a Harry para que dejara Hechizos y contrahechizos (encante a sus amig
1,conjurar,"Hermione revisaba sus apuntes, confiando en encontrar algunos de los encantamientos que deberían con"
1,empujar él,"—Harry gritó a Hermione, tratando de empujarla hacia la puerta, pero la niña no podía moverse."
1,jugoso,"Nadie dijo una palabra mientras el gigante trabajaba, pero cuando sacó del atizador las primeras sei"
1,mentir tú,"Por supuesto, no voy a mentirte."
1,afecto,"Hagrid miró a Harry con afecto y respeto brillando en sus ojos, pero Harry, en lugar de sentirse com"
1,músculo,No podía mover ni un músculo.
1,nublado,Cuando el señor y la señora Dursley se despertaron el sombrío y gris martes en el que nuestra histor
1,estúpidamente,—preguntó estúpidamente.
1,alegres,CAPÍTULO 10   Halloween   Malfoy no podía creer a sus ojos cuando vio que Harry y Ron todavía estaba
1,parquímetro,"Los transeúntes miraban mucho a Hagrid mientras recorrían el pueblecito camino de la estación, y Har"
1,callar,"Hermione abrió la boca, tal vez para decir a Ron cómo utilizar la Maldición de los Demonios, pero Ha"
1,enjugar él,"—dijo, enjugándose los ojos—."
1,deberiar,"—Deberías comprarte el uniforme —dijo Hagrid, señalando hacia «Madame Malkin, túnicas para cualquier"
1,contraalmirante,", sino que estalló como un cañonazo y los envolvió en una nube azul, mientras del interior salían un"
1,cemento,"Cogido por sorpresa, Harry cayó al suelo de cemento."
1,ramitar,Era vieja y algunas de las ramitas de paja sobresalían formando ángulos extraños.
1,calzada,"Aumentó hasta ser un rugido mientras los dos miraban hacia el cielo, y entonces una pesada moto cayó"
1,lagarto,"Detrás de los vidrios, toda clase de serpientes y lagartos se arrastraban y se deslizaban por las pi"
1,cliodna,"Hasta que finalmente apartó la vista de la druida Cliodna, que se rascaba la nariz, para abrir una b"
1,inexacto,A mí me parecen adivinos y la profesora McGonagall dice que ésa es una rama de la magia muy inexacta
1,ma,"Para Jessica, a quien le gustan las historias,  para Anne, a quien también le gustaban,  y para Di, "
1,asegurándola,"—dijo Wood jadeando, metiendo la pelota en la caja a la fuerza y asegurándola con las tiras—."
1,desprevenido,Mi tío abuelo Algie trataba de pillarme desprevenido y forzarme a que saliera algo de magia de mí.
1,fastidiaro,"Y voy a fastidiaros con la charla de un viejo, antes de que hinquemos el diente a los deliciosos man"
1,fanático,"Los Weasley se quejaban de que Wood se había convertido en un fanático, pero Harry estaba de acuerdo"
1,brown,"Brocklehurst, Mandy, también fue a Ravenclaw, pero Brown, Lavender, resultó la primera nueva Gryffin"
1,llevár,Nos hemos comido todo lo que llevábamos y vosotros parece que todavía tenéis algo.
1,alcornoque,si sois algo más que los alcornoques a los que habitualmente tengo que enseñar.
1,conducir él,"Fueron por un túnel oscuro que parecía conducirlos justo por debajo del castillo, hasta que llegaron"
1,acercándosele,"—Sé qué día es hoy —canturreó Dudley, acercándosele con andares de pato."
1,enseñar tú,"Puedo enseñaros cómo embotellar la fama, preparar la gloria, hasta detener la muerte."
1,burlarir,"No un sapo, los sapos pasaron de moda hace años, se burlarían."
1,pinchado,"Una mano pequeña se cerró sobre la carta y el niño siguió durmiendo, sin saber que era famoso, sin s"
1,adormecer él,"El señor Dursley cayó en un sueño intranquilo, pero el gato que estaba sentado en la pared del jardí"
1,autobús,"Una anciana con aspecto estrafalario, toda vestida de verde, también lo había saludado alegremente e"
1,delicado,"No espero que lleguéis a entender la belleza de un caldero hirviendo suavemente, con sus vapores rel"
1,desabrochada,"—les preguntó, mirando sus rostros sudorosos y rojos y sus batas desabrochadas colgando de sus hombr"
1,saliar,Salía un tren para Londres cinco minutos más tarde.
1,bibliotecaria,"La señora Pince, la bibliotecaria, empuñó un plumero ante su cara."
1,fi,La señora Figg se ha fracturado una pierna.
1,lavar él,"Tía Petunia creyó que debía de haberse encogido al lavarlo y, para su gran alivio, Harry no fue cast"
1,magullado,Tenía una pierna magullada y llena de sangre.
1,aseguer,—Es mejor que nos pongamos la capa aquí y nos aseguremos de que nos cubre a los tres.
1,supremo,Sacó la carta y leyó:    COLEGIO HOGWARTS  DE MAGIA Y HECHICERÍA  Director: Albus Dumbledore (Orden 
1,hamburguesería,"Pasaron ante librerías y tiendas de música, ante hamburgueserías y cines, pero ningún sitio donde pa"
1,lanzamiento,Tengo que volar alrededor de nuestros aros y detener los lanzamientos del otro equipo.
1,derribar él,Era como si la escoba intentara derribarlo.
1,gritar él,"—tuvo tiempo de gritarle, mientras lanzaba la bludger con furia hacia Marcus Flint."
1,fracturado,—La muñeca fracturada —la oyó murmurar Harry—.
1,decena,"Y además, por supuesto, estaba el gran tamaño de la biblioteca, decenas de miles de libros, miles de"
1,desventaja,"Sin embargo, las piezas de ajedrez viejas no eran una desventaja."
1,contradecir él,"Parecía tan peligroso, con la mitad de su bigote arrancado, que nadie se atrevió a contradecirlo."
1,grumoso,Estaba cubierta por lo que parecía un pegamento gris grumoso.
1,propagar,Y luego se propagó la historia.
1,lo,"Para Jessica, a quien le gustan las historias,  para Anne, a quien también le gustaban,  y para Di, "
1,bathilda,"— Historia de la magia, Bathilda Bagshot."
1,atrapa,"El saco de boxeo favorito de Dudley era Harry, pero no podía atraparlo muy a menudo."
1,guante,"Cuanto más intentaba pasárselo por la cabeza, más pequeña se volvía la prenda, hasta que finalmente "
1,abrazar él,"—exclamó, abrazándolo."
1,jugaré,—Jugaré —informó a Ron y Hermione—.
1,humedad,Le gustan la oscuridad y la humedad.
1,barredora,"Vamos a tener que darle una escoba decente, profesora, una Nimbus 2000 o una Barredora 7."
1,grandísimo,"—Bah, cierra la boca, Dursley, grandísimo majadero —dijo el gigante."
1,jamón,"Del techo colgaban jamones y faisanes, una cazuela de cobre hervía en el fuego y en un rincón había "
1,armario,"Y de pronto, sus armarios se vaciaron, sus equipajes estuvieron listos, el sapo de Neville apareció "
1,sirviéndose,Harry estaba sirviéndose una patata rellena cuando el profesor Quirrell llegó rápidamente al comedor
1,papelón,—Aún no sabes si vas a hacer un papelón —dijo razonablemente Ron—.
1,dictado,"Pero la asignatura más aburrida era Historia de la Magia, la única clase dictada por un fantasma."
1,locutor,—El locutor se permitió una mueca irónica—.
1,chasquear,Quirrell chasqueó los dedos.
1,mezclado,"Mantener el huevo en el fuego, porque las madres respiran fuego sobre ellos, y, cuando salen del cas"
1,azkaban,Títulos disponibles en la serie de Harry Potter (en orden de aparición):      Harry Potter y la pied
1,er,¿ERES UNA BRUJA O NO.
1,jactanciosa,Se quejaba en voz alta porque los de primer año nunca estaban en los equipos de quidditch y contaba 
1,ofendáis,"Por fin dijo:  —Bueno, no os ofendáis, pero ninguno de vosotros es muy bueno en ajedrez."
1,podrido,"Luego visitaron la botica, tan fascinante como para hacer olvidar el horrible hedor, una mezcla de h"
1,habituado,"Se incorporó y miró alrededor, con ojos no habituados a la penumbra."
1,expulsarte,¡Van a expulsarte.
1,diagonal,"muévete en diagonal, cuatro casillas a la derecha."
1,sacado,"Un bezoar es una piedra sacada del estómago de una cabra, y sirve para salvarte de la mayor parte de"
1,detesto,—Los detesto a los dos —añadió Harry—.
1,alfiler,"En el fondo de la tienda, un niño de rostro pálido y puntiagudo estaba de pie sobre un escabel, mien"
1,grandeza,", lo tienes todo en tu cabeza y Slytherin te ayudaría en el camino hacia la grandeza."
1,vuestrir,Vuestro castigo tendrá lugar a las once de la noche.
1,brillantes,¿Brillantes.
1,tiró,Tiró la bola de cristal hacia arriba y bajó a tierra con su escoba.
1,mejora,"Aunque aquello significaba una mejora en muchos aspectos, después de un tiempo resultaba un poco dep"
1,quimero,Sólo sombra y quimera.
1,proclamar,Harry no había faltado a ninguna regla y Lee Jordan seguía proclamando alegremente el resultado.
1,necesitas,¿Necesitas ayuda.
1,déjese,¡Déjese ver.
1,igualar él,"Tal vez yo detenga un poco a Snape, pero la verdad es que no puedo igualarlo."
1,decapitar él,"Era evidente que alguien había tratado de decapitarlo, pero que no lo había hecho bien."
1,antojo,"Por la noche leía en la cama hasta tarde, mientras Hedwig entraba y salía a su antojo por la ventana"
1,levanto,Ya me levanto.
1,curry,"Harry encontró tostadas, coco, judías cocidas, fresa, curry, hierbas, café y sardinas, y fue lo bast"
1,áfrica,"—Charlie está en Rumanía, estudiando dragones, y Bill está en África, ocupándose de asuntos para Gri"
1,resoplido,Dos enormes pies aparecían por debajo del árbol y un gran resoplido les indicó que Hagrid estaba det
1,proferir,El efecto que esta simple frase produjo en la familia fue increíble: Dudley ahogó un grito y se cayó
1,gustarte,"Nunca pensé que podían gustarte los gorditos llorones, Parvati."
1,calla,—Callaos los dos —dijo Harry en tono cortante—.
1,prisionero,Títulos disponibles en la serie de Harry Potter (en orden de aparición):      Harry Potter y la pied
1,estrellar,Cuando le dieron permiso para salir de su alacena ya habían comenzado las vacaciones de verano y Dud
1,ejem,—Ejem.
1,servir yo,¿Puedo servirme una rana.
1,dejes,"Ron, ven desde arriba; Hermione, quédate abajo y no la dejes descender."
1,sumamente,Han estado sumamente preocupados.
1,reaparecer,Harry se enteró de que había setecientas formas de cometer una falta y de que todas se habían produc
1,comp,"La señora Potter era hermana de la señora Dursley, pero no se veían desde hacía años; tanto era así "
1,hazlo,—Hazlo de nuevo —ordenó Dudley.
1,erizar,A Harry se le erizaron los pelos de la nuca.
1,llorser,"—¡Mi pequeñito Dudley, no llores, mamá no dejará que él te estropee tu día especial."
1,alienígena,"Tenía hambre, se había perdido cinco programas de televisión que quería ver y nunca había pasado tan"
1,tentáculo,Los gemelos Weasley y Lee Jordan se dedicaban a pinchar los tentáculos de un calamar gigante que tom
1,échalo,¡Échalo.
1,creerás,No creerás que tus padres no te dejaron nada.
1,celoso,"Así que Malfoy, celoso y enfadado, había vuelto a meterse con Harry por no tener una familia apropia"
1,barrer,"Llevaba una túnica larga, una capa color púrpura que barría el suelo y botas con tacón alto y hebill"
1,anuncio,Tengo algunos anuncios que haceros para el comienzo del año.
1,terribl,"Terribles, sí, pero grandiosas."
1,estrictamente,"bien, no me está permitido hacer magia, hablando estrictamente."
1,listón,Podría decirse que tengo el listón muy alto.
1,inclinación,"—Espero que nos veamos pronto, profesora McGonagall —dijo Dumbledore, saludándola con una inclinació"
1,pelusa,"Porque ahora están vacías y llenas de aire,  pulgas muertas y un poco de pelusa."
1,aturdido,Harry miró a Ron y se calmó al ver en su rostro aturdido que él tampoco se había aprendido todos los
1,quedaría,"Pensaste que si se equivocaba quedarías bien, ¿no es cierto."
1,pidiéndome,Murieron pidiéndome misericordia.
1,characters,Rowling 1997  Copyright de la edición en castellano © Ediciones Salamandra 1999  Ilustración de cubi
1,salid,¡Salid al trote.
1,vuelto,—¿TE HAS VUELTO LOCA.
1,babeant,"Tenía tres cabezas, seis ojos que giraban enloquecidos, tres narices que se contraían y temblaban en"
1,abovedado,"Un segundo más tarde estaban contemplando un pasaje abovedado lo bastante grande hasta para Hagrid, "
1,autor,"Esperaba acostado a que llegara la hora de su cumpleaños, pensando si los Dursley se acordarían y pr"
1,lamer él,"—Estáis en vuestra casa —dijo Hagrid, soltando a Fang, que se lanzó contra Ron y comenzó a lamerle l"
1,calidez,"Sus ojos eran tan negros como los de Hagrid, pero no tenían nada de su calidez."
1,contrahechizos,Hagrid casi tuvo que arrastrar a Harry para que dejara Hechizos y contrahechizos (encante a sus amig
1,permanente,Añoraba tanto Hogwarts que estar lejos de allí era como tener un dolor de estómago permanente.
1,jerez,"Unas ancianas estaban sentadas en un rincón, tomando copitas de jerez."
1,empujón,No parecía disgustado por el empujón.
1,molino,"—gritó, agitando sus largos brazos como un molino."
1,paws,"Harry sabía que debería sentir pena por la pierna de la señora Figg, pero no era fácil cuando record"
1,repasar él,—Creo que deberíamos repasarlo todo otra vez —dijo tío Vernon—.
1,enfurecer él,Hagrid pareció enfurecerse consigo mismo.
1,trenza,"Una niña de rostro rosado y trenzas rubias salió de la fila, se puso el sombrero, que la tapó hasta "
1,bulstrode,"Bulstrode, Millicent, fue a Slytherin."
1,related,Rowling 1997  Copyright de la edición en castellano © Ediciones Salamandra 1999  Ilustración de cubi
1,pecado,"Entra, desconocido, pero ten cuidado  con lo que le espera al pecado de la codicia,  porque aquellos"
1,alféizar,"Dudley roncaba, pero Harry permaneció despierto, sentado en el alféizar de la ventana, contemplando "
1,perla,"De un color blanco perla y ligeramente transparentes, se deslizaban por la habitación, hablando unos"
1,inflamar,"A la mañana siguiente, la mano mordida de Ron se había inflamado y tenía dos veces su tamaño normal."
1,caligrafía,"La caligrafía, apretada y sinuosa, era desconocida para él."
1,resbalando,"Resbalando y a tientas, siguieron a Hagrid por lo que parecía un empinado y estrecho sendero."
1,masticar,"masticó su hamburguesa, intentando encontrar las palabras."
1,dado,Había olvidado a la gente con capa hasta que pasó cerca de un grupo que estaba al lado de la panader
1,mencionara,—Te agradecería que no le mencionaras esto a nadie de Hogwarts —dijo—.
1,batacazo,El efecto que esta simple frase produjo en la familia fue increíble: Dudley ahogó un grito y se cayó
1,telediario,"Con un poco de suerte, cerraremos el trato, y el contrato estará firmado antes del telediario de las"
1,notablemente,"Aquello tampoco estaba mal, pensó Harry, chupándolo mientras observaban a un gorila que se rascaba l"
1,avisáis,"Bueno, si alguno ve algo, me avisáis, ¿de acuerdo."
1,cuadradito,—gritó al cuadradito de luz del tamaño de un sello que era la abertura de la trampilla—.
1,pastelito,"Bloques de helado de todos los sabores que uno se pudiera imaginar, pasteles de manzana, tartas de m"
1,vigilado,"El amigo de los gemelos Weasley, Lee Jordan, era el comentarista del partido, vigilado muy de cerca "
1,abundante,"Tenía la cara grande y rosada, poco cuello, ojos pequeños de un tono azul acuoso, y abundante pelo r"
1,desgarrar,"Esperaba sentir picos agudos y garras desgarrando su cuerpo, pero no sucedió nada."
1,warner,Rowling 1997  Copyright de la edición en castellano © Ediciones Salamandra 1999  Ilustración de cubi
1,sién,El efecto que esta simple frase produjo en la familia fue increíble: Dudley ahogó un grito y se cayó
1,rigurosamenta,"Queda rigurosamenta prohibida, sin la autorización de los titulares del “Copyright”, bajo las sancio"
1,rosada,"Diez años antes, había una gran cantidad de retratos de lo que parecía una gran pelota rosada con go"
1,constructor,"Un rico constructor y su esposa irían a cenar, y tío Vernon esperaba obtener un pedido descomunal."
1,defender él,"Quería decir algo para defenderse, pero no podía controlar la voz."
1,besado,"Diez años antes, había una gran cantidad de retratos de lo que parecía una gran pelota rosada con go"
1,sólidamente,El lago estaba sólidamente congelado y los gemelos Weasley fueron castigados por hechizar varias bol
1,espectáculo,"Pero cuando estuvieron dentro la luz súbitamente inundó el lugar, para revelar un espectáculo asombr"
1,anne,"Para Jessica, a quien le gustan las historias,  para Anne, a quien también le gustaban,  y para Di, "
1,muchísimas,Estaba seguro de que había muchísimas personas que se llamaban Potter y que tenían un hijo llamado H
1,apreciar él,Fred y George han perdido puntos muchas veces desde que están aquí y la gente sigue apreciándolos.
1,sortear él,"—Tal vez Snape ha descubierto cómo sortearlo sin preguntarle a Hagrid —dijo Ron, mirando los miles d"
1,fregadero,Parecía proceder de un gran cubo de metal que estaba en el fregadero.
1,servir él,Tía Petunia tuvo que servirle una copa de brandy.
1,distintivo,tengo un distintivo como el de Bill y estoy levantando la Copa de las Casas y la copa de quidditch.
1,switch,"— Guía de transformación para principiantes, Emeric Switch."
1,calzado,"Sus manos tenían el mismo tamaño que las tapas del cubo de la basura y sus pies, calzados con botas "
1,hospital,—Llevamos a Dudley al hospital —gruñó tío Vernon—.
1,cuanta,"El montón de varitas ya probadas, que estaban sobre la silla, crecía por momentos, pero, cuantas más"
1,encariñado,La señora Figg se había fracturado la pierna al tropezar con un gato y ya no parecía tan encariñada 
1,agítela,Cójala y agítela.
1,whinging,"Potter  Alacena Debajo de la Escalera  Privet Drive, 4  Little Whinging  Surrey    El sobre era grue"
1,reñiar,—Harry oyó que Hermione lo reñía—.
1,desagradar,"Si había algo que desagradaba a los Dursley aún más que las preguntas que Harry hacía, era que habla"
1,alga,"El interior era horrible: había un fuerte olor a algas, el viento se colaba por las rendijas de las "
1,fabuloso,"Algo realmente extraordinario tenía que haber en aquella cámara de máxima seguridad, Harry estaba se"
1,obrar,"—Estoy seguro de que Firenze pensó que estaba obrando de la mejor manera posible —dijo, con voz somb"
1,déjano,"—Déjanos mirar, Lee, vamos."
1,ensanchar,"Con esas últimas palabras, el pecho de Hagrid se ensanchó."
1,descubriste,"Deslizándote por el colegio de aquella manera en Halloween; por lo que sé, me descubriste cuando iba"
1,chispas,"¡Chispas rojas, los otros tienen problemas."
1,noqueado,Parecía noqueado.
1,murierar,Pero nunca quiso que murieras.
1,quinientos,"Yo tengo como quinientos, pero no consigo ni a Agripa ni a Ptolomeo."
1,perks,"Más tarde Perks, Sally-Anne."
1,chiquillada,He venido porque fuera están haciendo chiquilladas y corriendo por los pasillos —dijo Hermione en to
1,mora,"Un centenar de gordos pavos asados, montañas de patatas cocidas y asadas, fuentes de grasientas salc"
1,sisear,—siseó la profesora McGonagall—.
1,corrigiendo él,"Luego, la señora Hooch les enseñó cómo montarse en la escoba sin deslizarse hasta la punta, y recorr"
1,bendito,—¡Bendito sea.
1,guardabosqu,Pero Dumbledore dejó que me quedara como guardabosques.
1,des,"Para Jessica, a quien le gustan las historias,  para Anne, a quien también le gustaban,  y para Di, "
1,siéntatir,—Siéntate —gritó a Hermione—.
1,gorra,", sino que estalló como un cañonazo y los envolvió en una nube azul, mientras del interior salían un"
1,mordido,"A la mañana siguiente, la mano mordida de Ron se había inflamado y tenía dos veces su tamaño normal."
1,amainar,El dolor en la cabeza amainó.
1,ventaja,Había tantas cosas que aprender que ni siquiera un chico como Ron tenía mucha ventaja.
1,besos,"Besos,  Charlie  Se miraron."
1,copiosamente,Hagrid bebía copiosamente de su copa.
1,sna,"No es raro que parezca tan nervioso, ése es el profesor Snape."
1,atemorizar,"La idea de Voldemort los atemorizaba, desde luego, pero no los visitaba en sueños y estaban tan ocup"
1,déjala,—¡Déjala —gritó Harry— o te bajaré de esa escoba.
1,estrangular él,"Por lo que Harry había visto, la serpiente no había hecho más que darles un golpe juguetón en los pi"
1,plátano,La comida de tío Vernon resultó ser cuatro plátanos y una bolsa de patatas fritas para cada uno.
1,entrometer él,Harry estaba a mitad de camino cuando recordó que se había prometido no entrometerse.
1,po,"Eran las últimas personas que se esperaría encontrar relacionadas con algo extraño o misterioso, por"
1,extravagante,"Estaba muy extravagante, con un gran turbante púrpura."
1,pue,"La señora Potter era hermana de la señora Dursley, pero no se veían desde hacía años; tanto era así "
1,jigger,"— Filtros y pociones mágicas, Arsenius Jigger."
1,rowling,Rowling 1997  Copyright de la edición en castellano © Ediciones Salamandra 1999  Ilustración de cubi
1,curvar,Los labios de Snape se curvaron en un gesto burlón.
1,reprografía,"Queda rigurosamenta prohibida, sin la autorización de los titulares del “Copyright”, bajo las sancio"
1,desvanecir,"Los reflejos no se desvanecían y Harry miraba y miraba, hasta que un ruido lejano lo hizo volver a l"
1,incrédulo,"Harry levantó la mirada, incrédulo."
1,redonda,"Llevaba gafas redondas siempre pegadas con cinta adhesiva, consecuencia de todas las veces que Dudle"
1,chaparrón,"Telespectadores de lugares tan apartados como Kent, Yorkshire y Dundee han telefoneado para decirme "
1,newt,"— Animales fantásticos y dónde encontrarlos, Newt Scamander."
1,expresamente,"Marcus Flint había cerrado el paso de Harry expresamente, y la escoba de éste se había desviado de s"
1,propinar,"Éste le propinó a Harry una palmada en el brazo, dándole la horrible sensación de haberlo metido en "
1,rasgadura,"Una rasgadura cerca del borde se abrió, ancha como una boca, y el sombrero comenzó a cantar:  Oh, po"
1,besó,Besó a Percy en la mejilla y el muchacho se fue.
1,picadora,"Mientras tío Vernon llamaba a la estafeta y a la lechería, tratando de encontrar a alguien para quej"
1,asfode él,¿Qué obtendré si añado polvo de raíz de asfódelo a una infusión de ajenjo.
1,recibirar,¡Y no recibirás una bofetada.
1,llegaste,—¿Cómo llegaste aquí.
1,reanimé,"—Bueno, yo volví —dijo Hermione—, reanimé a Ron (tardé un rato largo) y, cuando íbamos a la buhonera"
1,colgaro,"colgaros de las muñecas, del techo, unos pocos días."
1,tortura,"Las clases de Pociones se convirtieron en torturas semanales para Harry, por la forma en que lo trat"
1,pensante,Porque soy el Sombrero Pensante.
1,macizo,"Hagrid tampoco dejó que Harry comprara un caldero de oro macizo (en la lista decía de peltre), pero "
1,deuda,El profesor Snape no podía soportar estar en deuda con tu padre.
1,intensamente,Harry se movió frente al vidrio y miró intensamente a la serpiente.
1,mortalmente,"La sala estaba mortalmente silenciosa— por todo su temple y sobresaliente valor, premio de sesenta p"
1,manecilla,Tenía doce manecillas y ningún número; pequeños planetas se movían por el perímetro del círculo.
1,equivaler,"Diecisiete sickles de plata hacen un galeón y veintinueve knuts equivalen a un sickle, es muy fácil."
1,bandadas,"Bandadas de búhos, estrellas fugaces."
1,delata,"—No, si no nos delatas, Peeves, por favor."
1,busques,"Continuó:  —El espejo será llevado a una nueva casa mañana, Harry, y te pido que no lo busques otra "
1,apañaba,"Yo llegué a tiempo para evitarlo, aunque debo decir que te las apañabas muy bien tú solo."
1,ácido,En el preciso momento en que estaba diciéndoles a todos que miraran la perfección con que Malfoy hab
1,loro,"Con las manos temblorosas, Harry le dio la vuelta al sobre y vio un sello de lacre púrpura con un es"
