"Frequency","Word","Sentence"
1,deberías,"—Deberías comprarte el uniforme —dijo Hagrid, señalando hacia «Madame Malkin, túnicas para cualquier"
1,tuviste,Y tuviste la mala suerte de crecer en una familia de los más grandes muggles que haya visto.
1,ultraje,¡Eso es un ultraje.
1,soporte,"Era un espejo magnífico, alto hasta el techo, con un marco dorado muy trabajado, apoyado en unos sop"
1,enseñándosela,"—Bien —contestó, enseñándosela—."
1,cuent,Quiero que me cuentes todo lo de tu primera semana.
1,ilusionado,"A la mañana siguiente, Harry se despertó a las cinco, tan emocionado e ilusionado que no pudo volver"
1,abatimiento,"—Oh, sí —dijo el señor Dursley, con una espantosa sensación de abatimiento—."
1,enmarañada,"Harry pudo ver un claro, más adelante, a través de las enmarañadas ramas de un viejo roble."
1,cuarta,"Elige, a menos que quieras quedarte para siempre;  para ayudarte en tu elección, te damos cuatro cla"
1,nebulosa,"Anduvo por la hierba húmeda, reviviendo la última hora en su mente, en una feliz nebulosa: los Gryff"
1,margarita,"«Rayo de sol, margaritas, volved amarilla a esta tonta ratita."
1,dolorosamente,"Harry intentó quitárselo, pero le apretaba dolorosamente, y entonces apareció Malfoy, que se burló d"
1,bondadosamente,"—preguntó bondadosamente, y Harry asintió con la cabeza."
1,agregar,—Así que —dijo Dumbledore— tengo algunos puntos de última hora para agregar.
1,debí,Supuso que debía de ser una moda nueva.
1,nombrar,"Después de todo, El-que-no-debe-ser-nombrado hizo grandes cosas."
1,usar él,"Por favor, alégrate, Hagrid, salvamos la Piedra, ya no está, no podrá usarla."
1,flojo,"Estos fantásticos petardos no tenían nada que ver con los flojos artículos de los muggles, que Dudle"
1,atreir,Y no te atrevas a dejar que se queme.
1,practicad,Sacad vuestras varitas y practicad ahora.
1,mojar,"—dijo Harry, impresionado al ver la pena y el remordimiento de Hagrid, y las lágrimas que mojaban su"
1,gárgolas,"—Gárgolas galopantes, Harry, la gente todavía tiene miedo."
1,gusto,—Podría estar muerta y no notarías la diferencia —dijo Ron con disgusto—.
1,reconfortado,"»)  Harry, que comenzaba a sentirse reconfortado y soñoliento, miró otra vez hacia la mesa de los pr"
1,prefectos,—¡Prefectos.
1,preferido,"—¿Qué tal: «En el colegio nos han mandado escribir una redacción sobre nuestro héroe preferido, seño"
1,ampolla,"Harry vio que estaban quemadas, en carne viva, con ampollas rojas y brillantes."
1,dentista,"—Ningún riesgo, ya que ambos son dentistas —respondió Hermione."
1,toda,Cuando el señor y la señora Dursley se despertaron el sombrío y gris martes en el que nuestra histor
1,barro,La sala común estaba abarrotada y bulliciosa.
1,d,"Para Jessica, a quien le gustan las historias,  para Anne, a quien también le gustaban,  y para Di, "
1,serás,"Ya verás, serás muy famoso en Hogwarts."
1,mugglessepan,"—Bueno, su trabajo principal es impedir que los mugglessepan que todavía hay brujas y magos por todo"
1,hemorragia,"Anduvo por la hierba húmeda, reviviendo la última hora en su mente, en una feliz nebulosa: los Gryff"
1,alarmarir,"Un viejo y enjuto guarda estaba al otro lado de la taquilla, dejándolos pasar de dos en dos o de tre"
1,trasplantador,"Cuando al final de las clases sonó la campana del castillo, los tres dejaron sus trasplantadores y c"
1,poner yo,¡Podría ponerme a cantar.
1,puñetazo,—La tiras y le das un puñetazo en la nariz —le sugirió Ron.
1,polo,"Los Dursley compraron a Dudley y a Piers unos grandes helados de chocolate en la entrada, y luego, c"
1,sinuoso,"La caligrafía, apretada y sinuosa, era desconocida para él."
1,reprochar,"—Si queréis regresar, no os lo reprocharé —dijo—."
1,elegido,"Ni se detuvo para disculparse cuando atropelló al profesor Quirrell y, cuando llegó a donde estaba S"
1,comentarista,"El amigo de los gemelos Weasley, Lee Jordan, era el comentarista del partido, vigilado muy de cerca "
1,paracelso,"Muy pronto tuvo no sólo a Dumbledore y Morgana, sino también a Hengist of Woodcroft, a Alberic Grunn"
1,serpenteante,"Habían desaparecido los campos cultivados y aparecían bosques, ríos serpenteantes y colinas de color"
1,interpretar,Harry interpretó que quería decir sí.
1,burro,¡No es asunto nuestro el andar como burros buscando humanos extraviados en nuestro bosque.
1,palidez,Tenía una palidez verdosa y Harry cruzó los dedos debajo de la mesa.
1,tararear,"Mientras trabajaba, tarareaba De puntillas entre los tulipanes y se sobresaltaba con cualquier ruido"
1,precio,"Un centenar de duendes estaban sentados en altos taburetes, detrás de un largo mostrador, escribiend"
1,conductor,"Acabo de ir a la locomotora, le he preguntado al conductor y me ha dicho que ya casi estamos llegand"
1,names,Rowling 1997  Copyright de la edición en castellano © Ediciones Salamandra 1999  Ilustración de cubi
1,hojarasca,"De vez en cuando, un rayo de luna a través de las ramas iluminaba una mancha de sangre azul plateada"
1,subida,"En segundos, toda la clase estaba subida a sus taburetes, mientras que Neville, que se había empapad"
1,estaréis,Dejad las escobas donde están o estaréis fuera de Hogwarts más rápido de lo que tardéis en decir qui
1,sentaro,"—Cuando yo os llame, deberéis poneros el sombrero y sentaros en el taburete para que os seleccionen "
1,corretear,"—Hagrid —dijo Harry, jadeando un poco mientras correteaba para seguirlo—, ¿no dijiste que había drag"
1,desgreñado,"Inclinó la gran cabeza desgreñada sobre Harry y le dio un beso, raspándolo con la barba."
1,vigor,La serpiente asintió vigorosamente.
1,posterior,"—Sí —dijo Quirrell, sin darle importancia, paseando alrededor del espejo para ver la parte posterior"
1,pub,Pero entonces se le ocurrió que debía de ser alguna tontería publicitaria; era evidente que aquella 
1,esconder él,"Dudley chilló y corrió a esconderse detrás de su madre, que estaba agazapada, aterrorizada, detrás d"
1,fudge,"Querían que Dumbledore fuera el ministro, claro, pero él nunca dejará Hogwarts, de modo que el viejo"
1,canoso,Tenía el pelo corto y canoso y ojos amarillos como los de un halcón.
1,recordáis,"Voldemort mató a mis padres, ¿lo recordáis."
1,indicia,Rowling 1997  Copyright de la edición en castellano © Ediciones Salamandra 1999  Ilustración de cubi
1,obligar yo,¡Deberían echarme y obligarme a vivir como unmuggle.
1,reglamentario,)    LIBROS  Todos los alumnos deben tener un ejemplar de los siguientes libros:  — Libro reglamenta
1,miras,—¿Por qué miras el seto.
1,jardincito,"El sol se elevaba en los mismos jardincitos, iluminaba el número 4 de latón sobre la puerta de los D"
1,dino,Simplemente dinos qué tenemos que hacer.
1,ptolomeo,"Yo tengo como quinientos, pero no consigo ni a Agripa ni a Ptolomeo."
1,tocar yo,—¿Y por qué Quirrell no podía tocarme.
1,temblar él,"Su cara se había puesto verde y, cuando el carro por fin se detuvo, ante una pequeña puerta en el pa"
1,dejadmar,Dejadme ver.
1,loca,—¿TE HAS VUELTO LOCA.
1,hablabas,—Pensaba que no nos hablabas —dijo él.
1,obstáculo,Se encontraron con un obstáculo.
1,parecertar,"Esa choza de Hagrid debe de parecerte un palacio, comparada con la casa de tu familia."
1,vaciar él,"» Hagrid había vaciado la cámara setecientos trece, si puede llamarse vaciarla a sacar un paquetito "
1,felicitación,¿Cómo es que no has recibido postales de felicitación.
1,decir yo,"Nos preguntábamos si podías decirnos si hay algo más que custodie la Piedra Filosofal, además de Flu"
1,hogueras,Tal vez la gente ha comenzado a celebrar antes de tiempo la Noche de las Hogueras.
1,jabalina,"Se inclinó hacia delante, cogió la escoba con las dos manos y se lanzó sobre Malfoy como una jabalin"
1,siguiéndome,"Estaba siguiéndome, tratando de averiguar hasta dónde había llegado."
1,disparar yo,¿Ibas a dispararme.
1,descubrir yo,"—Sí, sí, es todo muy triste, pero domínate, Hagrid, o van a descubrirnos —susurró la profesora McGon"
1,wight,"Había tres cartas en el felpudo: una postal de Marge, la hermana de tío Vernon, que estaba de vacaci"
1,gorgonas,"—Gorgonas galopantes, ahora me acuerdo —dijo Hagrid, golpeándose la frente con tanta fuerza como par"
1,harold,O Harold.
1,irreflexivamente,"Tal vez tenían que intentar sacar un conejo del sombrero, pensó Harry algo irreflexivamente, eso era"
1,verruga,"Si realmente era un mago, ¿por qué no se habían convertido en sapos llenos de verrugas cada vez que "
1,pétreo,"Mientras Harry y Ron regresaban al castillo para cenar, con los bolsillos llenos del pétreo pastel q"
1,llameante,"La que hablaba era una mujer regordeta que se dirigía a cuatro muchachos, todos con pelo de un llame"
1,erróneamente,"Los planetas ya han sido leídos erróneamente antes, hasta por centauros."
1,aplastada,Las plumas están aplastadas por un lado.
1,entraña,Harry sintió como si se le helaran las entrañas.
1,cautelosamente,"Salió cautelosamente del dormitorio, bajó la escalera, cruzó la sala común y pasó por el agujero del"
1,robo,¡Ese robo en Gringotts sucedió el día de mi cumpleaños.
1,pásame,—Pásame la sartén.
1,hayas,"Y muy bueno, debo añadir, en cuanto te hayas entrenado un poco."
1,fielmente,"Desde entonces le he servido fielmente, aunque muchas veces le he fallado."
1,esperándolo,"Hermione, sin embargo, estaba sola, cerca de la puerta, esperándolos."
1,descubridor,—Nicolás Flamel —susurró con tono teatral— es el único descubridor conocido de la Piedra Filosofal.
1,higiénico,"Sin embargo, la señora Pomfrey consideró que no era muy higiénico y lo confiscó."
1,detener yo,"Acepto que debía de saber lo que íbamos a intentar y, en lugar de detenernos, nos enseñó lo suficien"
1,ahíto,"Ron, ahíto de pavo y pastel y sin ningún misterio que lo preocupara, se quedó dormido en cuanto corr"
1,terrenos,"Soy Rubeus Hagrid, Guardián de las Llaves y Terrenos de Hogwarts."
1,carretada,"Había estado en la cabaña de Hagrid, ayudándolo a alimentar a Norberto, que por entonces comía carre"
1,procura,—Procura que tu mamá no te oiga hablar sobre mi colegio —contestó Harry con frialdad.
1,tambalearan,La idea hizo que de pronto las piernas de Harry se tambalearan.
1,montones,Montones de monedas de plata.
1,testimonio,Sólo las fotos de la repisa de la chimenea eran testimonio del tiempo que había pasado.
1,estupendo,—Yo creo que es estupendo —dijo Harry con frialdad.
1,anguila,"Escaparates repletos de barriles de bazos de murciélago y ojos de anguila, tambaleantes montones de "
1,destartalada,"En Hogwarts había 142 escaleras, algunas amplias y despejadas, otras estrechas y destartaladas."
1,insultar,Malfoy estaba insultando a su familia.
1,daría,—Daría cualquier cosa por tener una —dijo—.
1,ayuntamiento,"Le gustaba quejarse de muchas cosas: compañeros de trabajo, Harry, el ayuntamiento, Harry, el banco "
1,conllevar,"La razón exacta por la que Dudley podía querer una bicicleta era un misterio para Harry, ya que Dudl"
1,co,"Para Jessica, a quien le gustan las historias,  para Anne, a quien también le gustaban,  y para Di, "
1,guijarro,"Fueron por un túnel oscuro que parecía conducirlos justo por debajo del castillo, hasta que llegaron"
1,sirius,El joven Sirius Black me la ha dejado.
1,aparecido,"¿Aparecidos, fantasmas o estudiantillos detestables."
1,engrasado,"Yo todavía tengo las cadenas en mi despacho, las mantengo engrasadas por si alguna vez son necesaria"
1,aaauuu,—¡AAAUUU.
1,permitir yo,"Muévelo a él, podemos permitirnos perderlo."
1,respingo,Harry dio un respingo.
1,denúncialo,¡Denúncialo.
1,capucha,Una figura encapuchada bajó sigilosamente la escalera principal del castillo.
1,bebido,"sólo unas pocas palabras más, ahora que todos hemos comido y bebido."
1,pegamento,Estaba cubierta por lo que parecía un pegamento gris grumoso.
1,ceño,"Por supuesto que en Crabbe y Goyle no había nada que justificara el diminutivo, pero como la mesa de"
1,brillantemente,"Llegaron hasta el final del pasillo y vieron ante ellos una habitación brillantemente iluminada, con"
1,plegable,"Hagrid tampoco dejó que Harry comprara un caldero de oro macizo (en la lista decía de peltre), pero "
1,alada,"En Hogwarts había 142 escaleras, algunas amplias y despejadas, otras estrechas y destartaladas."
1,patatas,"¿Patatas, Harry."
1,vehículo,"—Me la han prestado, profesor Dumbledore —contestó el gigante, bajando con cuidado del vehículo mien"
1,desconcierto,Dumbledore sonrió ante la expresión de desconcierto que se veía en el rostro de Harry.
1,negar él,"—Yo no lo haría —dijeron al mismo tiempo, pero Harry pensaba que Snape no iba a negarse si había otr"
1,trucos,—¡NO VOY A PAGAR PARA QUE UN CHIFLADO VIEJO TONTO LE ENSEÑE TRUCOS DE MAGIA.
1,castor,"Por las ventanas de arriba veían a Hagrid descongelando las escobas en el campo de quidditch, enfund"
1,neblinoso,"Situados entre los estudiantes, los fantasmas tenían un neblinoso brillo plateado."
1,explicarte,—Déjame explicarte.
1,lent,"Un centenar de duendes estaban sentados en altos taburetes, detrás de un largo mostrador, escribiend"
1,mandona,"Tenía voz de mandona, mucho pelo color castaño y los dientes de delante bastante largos."
1,salváramo,—No habría necesitado que la salváramos si no hubiéramos encerrado a esa cosa con ella —le recordó H
1,conjuro,—Estoy pensando cuál sería el mejor conjuro para prenderle fuego —dijo Harry.
1,corroborar,—Exacto —corroboró con crueldad tío Vernon—.
1,pidiéndol,"—Envié búhos a todos los compañeros de colegio de tus padres, pidiéndoles fotos."
1,garcía,Título original: Harry Potter and the Philosopher’s Stone  Traducción: Alicia Dellepiane Rawson  Tra
1,diciéndolo,No podéis ir por ahí diciéndolo a gritos.
1,esbozar,—Dudley esbozó una sonrisa idiota—.
1,deleite,La expresión de intriga de Wood se convirtió en deleite.
1,ahorrar yo,—Salvo que quieras ahorrarnos el trabajo —añadió Harry—.
1,alternativa,"Bueno, no hay alternativa."
1,pedías,Te he dicho que te diría algo si me lo pedías por favor.
1,olorós,"»Y por último, quiero deciros que este año el pasillo del lado derecho del tercer piso está fuera de"
1,habréis,"—Perdón —dijo—, ¿por casualidad no habréis visto un sapo."
1,bros,Rowling 1997  Copyright de la edición en castellano © Ediciones Salamandra 1999  Ilustración de cubi
1,trademarks,Rowling 1997  Copyright de la edición en castellano © Ediciones Salamandra 1999  Ilustración de cubi
1,irónico,—El locutor se permitió una mueca irónica—.
1,olvídalo,—Olvídalo —respondió rápidamente Harry.
1,esmoquin,"Al cruzar la puerta de la sala de estar, Harry vio a su tío Vernon y a Dudley con esmoquin y pajarit"
1,liberar,"Su turbante, les dijo, era un regalo de un príncipe africano como agradecimiento por haberlo liberad"
1,parada,"Al momento siguiente, treinta o cuarenta cartas salieron disparadas de la chimenea como balas."
1,regañadient,—No estoy diciendo que su corazón no esté donde debe estar —dijo a regañadientes la profesora McGona
1,cuartos,"» Harry miró hacia atrás y vio un arco de hierro donde debía estar la taquilla, con las palabras «An"
1,impresionante,"Encaramado en la cima de una alta montaña, al otro lado, con sus ventanas brillando bajo el cielo es"
1,silenciar,"Al ministro de Magia le ha costado trabajo silenciar ese asunto, te lo aseguro."
1,melena,Sus largas patas delgadas estaban dobladas en ángulos extraños por la caída y su melena color blanco
1,darnos,"¡Y luego, como si fuera poco, hubo esa explosión y nosotros tuvimos que quedarnos contigo."
1,revolotear,"El señor Ollivander estaba revoloteando entre los estantes, sacando cajas."
1,borrarl,Voy a borrarles la sonrisa de la cara si ganamos.
1,coraje,"Hay que tener un gran coraje para oponerse a nuestros enemigos, pero hace falta el mismo valor para "
1,pisar él,"Tío Vernon hizo otro ruido extraño, como un ratón al pisarlo."
1,chupar él,"Aquello tampoco estaba mal, pensó Harry, chupándolo mientras observaban a un gorila que se rascaba l"
1,costado,"Si no lo hubiera hecho así, aquella mañana le habría costado concentrarse en los taladros."
1,angustiado,"—Es la Inmovilización Total —dijo Hermione, angustiada—."
1,pensarer,"Seguro que os lo pensaréis dos veces antes de faltar a otra regla de la escuela, ¿verdad."
1,anotación,"Después de hacer una cantidad de complicadas anotaciones, les dio a cada uno una cerilla para que in"
1,extraviado,¡No es asunto nuestro el andar como burros buscando humanos extraviados en nuestro bosque.
1,clavar él,"—Hagrid se pasó los dedos por el pelo, clavándole una mirada de asombro—."
1,fijando él,"—Mantenerse alejado de los problemas ya es algo —dijo Hagrid, cogiendo sus binoculares y fijándolos "
1,candado,"Tío Vernon había incluso cerrado con candado la jaula de Hedwig, la lechuza de Harry, para que no pu"
1,arsenius,"— Filtros y pociones mágicas, Arsenius Jigger."
1,almorzar,Se marcharon a almorzar.
1,fúnebre,"Al final, sólo los gemelos Weasley seguían cantando, con la melodía de una lenta marcha fúnebre."
1,bajito,"Un hombre bajito que llevaba un sombrero de copa hablaba con el viejo cantinero, que era completamen"
1,regocijo,—dijo Filch con regocijo—.
1,dibujo,"Si había algo que desagradaba a los Dursley aún más que las preguntas que Harry hacía, era que habla"
1,autorización,"Queda rigurosamenta prohibida, sin la autorización de los titulares del “Copyright”, bajo las sancio"
1,are,Los Dursley se estremecían al pensar qué dirían los vecinos si los Potter apareciesen por la acera.
1,tamudo,tamudo p.
1,vigilarmar,decidió que tenía que vigilarme muy de cerca.
1,regreses,Es mejor que regreses con Hagrid.
1,bifurcar,"Después de andar un poco, vieron que el sendero se bifurcaba."
1,interceptarme,"Desgraciadamente, cuando todos andaban corriendo por ahí para buscarte, Snape, que ya sospechaba de "
1,colcha,—Oh —suspiró Ron cuando la escoba rodó sobre la colcha de la cama de Harry.
1,contraer,"Tenía tres cabezas, seis ojos que giraban enloquecidos, tres narices que se contraían y temblaban en"
1,regaliz,"En cambio, tenía Grageas Bertie Bott de Todos los Sabores, chicles, ranas de chocolate, empanada de "
1,muérdago,"Guirnaldas de muérdago y acebo colgaban de las paredes, y no menos de doce árboles de Navidad estaba"
1,mudser,Pensamos que estaría bien que te mudes al segundo dormitorio de Dudley.
1,hacer tú,Tengo algunos anuncios que haceros para el comienzo del año.
1,mover tú,"Elige, a menos que quieras quedarte para siempre;  para ayudarte en tu elección, te damos cuatro cla"
1,espasmo,"Por primera vez, un espasmo de miedo cruzó el rostro de Quirrell."
1,ordenado,"Una brisa agitó los pulcros setos de Privet Drive, que se disponían silenciosos y ordenados bajo un "
1,cáscara,Tenía grietas en la cáscara.
1,deslizándose,"Deslizándose silenciosamente sobre el castillo, vio a Snape entrando en el bosque."
1,palmeó,Palmeó una vez y las sogas cayeron.
1,sofocante,"En el interior, el calor era sofocante."
1,arremeteír,"—rugía otra vez Voldemort, y Quirrell arremetió contra Harry, haciéndolo caer al suelo y apretándole"
1,dirás,"Y no se lo dirás a nadie, ¿no es cierto."
1,lívido,"Por segunda vez, Harry había logrado escapar de las garras de Voldemort, pero por los pelos, y aún a"
1,préstamo,"Queda rigurosamenta prohibida, sin la autorización de los titulares del “Copyright”, bajo las sancio"
1,enjuto,"Un viejo y enjuto guarda estaba al otro lado de la taquilla, dejándolos pasar de dos en dos o de tre"
1,puntiaguda,"Sus alas puntiagudas eran enormes, comparadas con el cuerpo flacucho."
1,sangrante,"Con los ojos llorosos vieron, aplastado en el suelo frente a ellos, un trol más grande que el que ha"
1,espinaca,"Ya sabes, tienes todos los comunes, como chocolate, menta y naranja, pero también puedes encontrar e"
1,follaje,"Por encima del ruido del follaje, le pareció oír una vez más lo que Hagrid le había dicho la noche e"
1,sacad,Sacad vuestras varitas y practicad ahora.
1,apoyaréis,"Si nos encuentra a los tres, yo le diré la verdad, que estaba tratando de deteneros, y vosotros me a"
1,pontir,"—Pero mira bien, vamos, ponte donde estoy yo."
1,musgo,Pasaron por un tocón con musgo.
1,salgáis,Os sugiero que salgáis y disfrutéis del sol.
1,perdone,"por supuesto que no, usted es invisible, perdone al viejo Peeves por su broma, señor."
1,lechucería,"Id directamente a la lechucería y enviad a Hedwig a Dumbledore, lo necesitamos."
1,traer él,"Estaré encantado de quedarme con el ridgeback noruego, pero no será fácil traerlo aquí."
1,triturar,"Mientras tío Vernon llamaba a la estafeta y a la lechería, tratando de encontrar a alguien para quej"
1,visual,"Tu amiga, la señorita Granger, accidentalmente me atropelló cuando corría a prenderle fuego a Snape,"
1,reaccionar,No sé por qué la escoba de Harry ha reaccionado de esa manera.
1,considerado,"Considerado por casi todo el mundo como el más grande mago del tiempo presente, Dumbledore es partic"
1,phyllida,"— Mil hierbas y hongos mágicos, Phyllida Spore."
1,esperándote,"Todos están esperándote en la sala común, vamos a celebrar una fiesta, Fred y George robaron unos pa"
1,pulcro,"Una brisa agitó los pulcros setos de Privet Drive, que se disponían silenciosos y ordenados bajo un "
1,bondadós,Detrás de la barba enmarañada y las espesas cejas había una sonrisa muy bondadosa.
1,recorte,"Mientras Ron le hablaba a Hagrid del trabajo de Charlie con los dragones, Harry miró el recorte del "
1,prevenirtar,"Estaba tratando de encontrarte para prevenirte, oí que Malfoy decía que iba a atraparte, dijo que te"
1,axila,"—Midió al niño del hombro al dedo, luego de la muñeca al codo, del hombro al suelo, de la rodilla a "
1,coles,Coles.
1,delicia,"Entonces —continuó Dumbledore, bajando del pupitre para sentarse en el suelo con Harry—, tú, como ci"
1,tic,Debía de haber sido una ilusión óptica.
1,prado,Llevaba un paquete largo y delgado y no contestó a tía Petunia cuando le preguntó qué había comprado
1,criticar,"Se paseó con su larga capa negra, observando cómo pesaban ortiga seca y aplastaban colmillos de serp"
1,sorbo,El gigante tomó un sorbo de té y se secó la boca con el dorso de la mano.
1,celebridad,celebridad.
1,nosotras,"Harry miró por encima de su hombro para leerlo:  El peligro yace ante ti, mientras la seguridad está"
1,arreglar él,¿Cómo podrían arreglarlo.
1,pelambrera,"Su rostro estaba prácticamente oculto por una larga maraña de pelo y una barba desaliñada, pero podí"
1,alancear,"Ante el peligro de ser alanceado con la punta de un paraguas empuñado por un gigante barbudo, el val"
1,segunda,"Elige, a menos que quieras quedarte para siempre;  para ayudarte en tu elección, te damos cuatro cla"
1,preguntéis,"—Bueno, no me preguntéis más —dijo con rudeza Hagrid—."
1,codazo,"Harry, sin dejar de vitorear, dio un codazo a Ron y señaló a Malfoy, que no podía haber estado más a"
1,manchita,"—Mantenerse alejado de los problemas ya es algo —dijo Hagrid, cogiendo sus binoculares y fijándolos "
1,repisa,Sólo las fotos de la repisa de la chimenea eran testimonio del tiempo que había pasado.
1,pisái,Mirad bien dónde pisáis.
1,incendiar,El profesor tardó unos treinta segundos en darse cuenta de que se incendiaba.
1,fascinante,"Luego visitaron la botica, tan fascinante como para hacer olvidar el horrible hedor, una mezcla de h"
1,contonear él,"Dudley se acercó contoneándose, lo más rápido que pudo."
1,spore,"— Mil hierbas y hongos mágicos, Phyllida Spore."
1,desacostumbrado,¿Algo desacostumbrado.
1,materno,De forma que Harry se había criado con sus tíos maternos.
1,francamente,francamente.
1,gordon,"Piers, Dennis, Malcolm y Gordon eran todos grandes y estúpidos, pero como Dudley era el más grande y"
1,desprender,"Retorciéndose y alejándose, se desprendió de sus cuerpos y pudieron moverse."
1,delicadeza,—Nunca se lo he preguntado —dijo con delicadeza Nick Casi Decapitado.
1,ocultar él,"Elige, a menos que quieras quedarte para siempre;  para ayudarte en tu elección, te damos cuatro cla"
1,estándar,"1 caldero (peltre, medida estándar 2)."
1,piña,"Los tres chicos se apiñaron para tapar el fuego, ya que no estaban seguros de que aquello estuviera "
1,observador,"—Y, por último, observadores de pájaros de todas partes han informado de que hoy los búhos del país "
1,utilízalir,Utilízalo bien.
1,adivinar él,Pero como lo único que sabían con seguridad del misterioso objeto era que tenía unos cinco centímetr
1,concurrido,—No es raro que nadie la aguante —dijo a Harry cuando se abrían paso en el concurrido pasillo—.
1,tom,"—No puedo, Tom, estoy aquí por asuntos de Hogwarts —respondió él, poniendo una mano en el hombro de "
1,mojado,No sabía que tenía que estar mojado.
1,frenético,"Cuando Harry llamó, oyeron unos frenéticos rasguños y varios ladridos."
1,curvar él,"Llegaron hasta el final del pasillo y vieron ante ellos una habitación brillantemente iluminada, con"
1,domínate,"—Sí, sí, es todo muy triste, pero domínate, Hagrid, o van a descubrirnos —susurró la profesora McGon"
1,sufriréis,Los tres sufriréis castigos.
1,normalmente,"Después de todo, normalmente fingían que ella no tenía hermana."
1,llevárselo,"Cuando era más pequeño, Harry soñaba una y otra vez que algún pariente desconocido iba a buscarlo pa"
1,saltándoos,¡No me parece bien que sigáis saltándoos las reglas.
1,resistir él,Ron no pudo resistirse.
1,compensar,"Hasta Neville pasó a duras penas, pues sus buenas notas en Herbología compensaron los desastres en P"
