1,prevenir él,"Pobre metepatas Neville, Harry sabía lo que debía de haberle costado buscarlos en la oscuridad para prevenirlos."
1,forcejear,"Allí tuvo que forcejear con su hijo para quitarle la carta, lo que le resultaba difícil porque Harry le tiraba del cuello."
1,tétrico,"Hacía mucho más frío allí que arriba, en la parte principal del castillo, y habría sido igualmente tétrico sin todos aquellos animales conservados, flotando en frascos de vidrio, por todas las paredes."
1,negarir,"De todos modos, seguro que él esperaba que te negaras."
1,parlotear,"El señor Dursley canturreaba mientras se ponía su corbata más sosa para ir al trabajo, y la señora Dursley parloteaba alegremente mientras instalaba al ruidoso Dudley en la trona."
1,gales,El verde común de Gales y el negro de las Hébridas.
1,franco,"yo fui también a Hogwarts y, si he de ser franco, me expulsaron."
1,tortura,"Las clases de Pociones se convirtieron en torturas semanales para Harry, por la forma en que lo trataba Snape."
1,toque,"Tío Vernon dijo en tono cortante:  —No toques nada que él te dé, Dudley."
1,aspereza,—No es nada —dijo Hagrid con aspereza—.
1,montura,"En su lugar, le dirigía la sonrisa a una mujer de aspecto severo que llevaba gafas de montura cuadrada, idénticas a las líneas que había alrededor de los ojos del gato."
1,señalar yo,"Lo que tenemos que hacer es estar seguros de jugar limpio, así no le daremos excusa a Snape para señalarnos faltas."
1,encante,"Hagrid casi tuvo que arrastrar a Harry para que dejara Hechizos y contrahechizos (encante a sus amigos y confunda a sus enemigos con las más recientes venganzas: Pérdida de Cabello, Piernas de Mantequilla, Lengua Atada y más, mucho más), del profesor"
1,pitido,La señora Hooch dio un largo pitido con su silbato de plata.
1,respingo,Harry dio un respingo.
1,apañar,"Yo llegué a tiempo para evitarlo, aunque debo decir que te las apañabas muy bien tú solo."
1,dumbled,El nombre de aquel hombre era Albus Dumbledore.
1,harto,"Después de un té con bocadillos de pavo, bollos, bizcocho borracho con frutas y pastel de Navidad, todos se sintieron tan hartos y soñolientos que no podían hacer otra cosa que irse a la cama; no obstante, permanecieron sentados y observaron a Percy,"
1,renunciar,—¿Renunciar.
1,palmo,Entonces sucedió algo que le hizo dar un bote de un palmo.
1,habituado,"Se incorporó y miró alrededor, con ojos no habituados a la penumbra."
1,plátano,La comida de tío Vernon resultó ser cuatro plátanos y una bolsa de patatas fritas para cada uno.
1,lentitud,"Aquella noche, con Ron también cubierto por la capa, tuvieron que andar con más lentitud."
1,estuvieras,"—Me alegro de que estuvieras atenta en las clases de Herbología, Hermione —dijo Harry mientras se reunía con ella junto a la pared, secándose el sudor de la cara."
1,conque,Conque Harry Potter no es un mago.
1,diestro,"bien, soy diestro —respondió Harry."
1,saltándoos,¡No me parece bien que sigáis saltándoos las reglas.
1,grandilocuente,"—Oh, lo encontramos hace siglos —dijo Ron con aire grandilocuente—."
1,mentir tú,"Por supuesto, no voy a mentirte."
1,damar,—Dame un minuto.
1,inexacto,A mí me parecen adivinos y la profesora McGonagall dice que ésa es una rama de la magia muy inexacta.
1,crecer él,"Como castigo, lo encerraron en la alacena durante una semana, aunque intentó decirles que no podía explicar cómo había vuelto a crecerle tan deprisa."
1,disculpa,"Excusas, disculpas y locas historias cruzaban la mente de Harry, cada una más débil que la otra."
1,valorar él,"Malfoy miró a Crabbe y Goyle, valorándolos."
1,podrido,"Luego visitaron la botica, tan fascinante como para hacer olvidar el horrible hedor, una mezcla de huevos pasados y repollo podrido."
1,quimera,Sólo sombra y quimera.
1,restante,—Señaló las tres pelotas restantes.
1,hechizos,—Hechizos.
1,broche,"— Una capa de invierno (negra, con broches plateados)."
1,inquietar él,"La idea de Voldemort los atemorizaba, desde luego, pero no los visitaba en sueños y estaban tan ocupados repasando que no les quedaba tiempo para inquietarse por lo que Snape o algún otro estuvieran tramando."
1,hengist,"Muy pronto tuvo no sólo a Dumbledore y Morgana, sino también a Hengist of Woodcroft, a Alberic Grunnion, Circe, Paracelso y Merlín."
1,bulstrode,"Bulstrode, Millicent, fue a Slytherin."
1,diabólico,"Sucedió cuando una poderosa maldición diabólica te tocó; terminó con tu madre, tu padre e incluso la casa, pero no funcionó contigo, y por eso eres famoso, Harry."
1,atrever él,"Era evidente que creía que nadie iba a atreverse a buscarlos allí, con una tormenta a punto de estallar."
1,encendedor,Parecía un encendedor de plata.
1,efectivamente,"Efectivamente: su reflejo lo miraba, pero sólo su cabeza suspendida en el aire, porque su cuerpo era totalmente invisible."
1,abrigar,"Vamos, pruébatelo, son bonitos y abrigan."
1,rigurosamenta,"Queda rigurosamenta prohibida, sin la autorización de los titulares del “Copyright”, bajo las sanciones establecidas en las leyes, la reproducción parcial o total de esta obra por cualquier medio o procedimiento, incluidos la reprografía y el tratami"
1,dolorosamente,"Harry intentó quitárselo, pero le apretaba dolorosamente, y entonces apareció Malfoy, que se burló de Harry mientras éste luchaba para quitarse el turbante."
1,tufo,"Un tufo desagradable los invadió, haciéndoles taparse la nariz con la túnica."
1,festín,"El festín apareció de pronto en los platos dorados, como había ocurrido en el banquete de principio de curso."
1,estrechar yo,"Harry, haciendo de tripas corazón, contestó:  —Me veo con Dumbledore, estrechándonos las manos —inventó—."
1,exceso,"Las piernas de Harry otra vez parecían de plomo, pero sólo por el exceso de cansancio y comida."
1,curvar él,"Llegaron hasta el final del pasillo y vieron ante ellos una habitación brillantemente iluminada, con el techo curvándose muy alto por encima de ellos."
1,indiferente,"—repitió, y no parecía tan indiferente como de costumbre—."
1,ceño,"Por supuesto que en Crabbe y Goyle no había nada que justificara el diminutivo, pero como la mesa de los profesores estaba llena, no podían hacer más que crujir los nudillos y mirarlo con el ceño fruncido."
1,argus,"Pero aún peor que Peeves, si eso era posible, era el celador, Argus Filch."
1,pitar,Al principio se precipitaron a través de un laberinto de retorcidos pasillos.
1,aceptar él,Harry no podía aceptarlo.
1,desigual,"Querido Harry (decía con letra desigual):  Sé que tienes las tardes del viernes libres, así que ¿te gustaría venir a tomar una taza de té conmigo, a eso de las tres."
1,manejar,"Neville no había manejado una escoba en toda su vida, porque su abuela no permitía que se acercara a una."
1,vaciar él,"» Hagrid había vaciado la cámara setecientos trece, si puede llamarse vaciarla a sacar un paquetito arrugado."
1,calentar él,Estaban de espaldas al fuego para calentarse cuando Snape cruzó el patio.
1,sacar yo,—Se ha portado muy bien al sacarnos de este lío —admitió Ron—.
1,agítela,Cójala y agítela.
1,eructo,"Harry quería seguir discutiendo, pero un eructo estruendoso y prolongado de Dudley, el hijo de los Dursley, ahogó sus palabras."
1,hilera,"Raíces secas y polvos brillantes llenaban las paredes, y manojos de plumas e hileras de colmillos y garras colgaban del techo."
1,barer,"Llevaba una túnica larga, una capa color púrpura que barría el suelo y botas con tacón alto y hebillas."
1,perforar,"Entonces, un dolor le perforó la cabeza, algo que nunca había sentido, como si la cicatriz estuviera incendiándose."
1,envoltorio,"Estaba rompiendo el envoltorio de un reloj de oro cuando tía Petunia volvió, enfadada y preocupada a la vez."
1,erróneamente,"Los planetas ya han sido leídos erróneamente antes, hasta por centauros."
1,insultar,Malfoy estaba insultando a su familia.
1,indispuesto,"Si el sombrero hubiera mencionado una casa para la gente que se sentía un poco indispuesta, ésa habría sido la suya."
1,confederación,"Sacó la carta y leyó:    COLEGIO HOGWARTS  DE MAGIA Y HECHICERÍA  Director: Albus Dumbledore (Orden de Merlín, Primera Clase, Gran Hechicero, Jefe de Magos, Jefe Supremo, Confederación Internacional de Magos)."
1,mirar yo,—¡Mírame.
1,reliquias,Títulos disponibles en la serie de Harry Potter (en orden de aparición):      Harry Potter y la piedra filosofal  Harry Potter y la cámara secreta  Harry Potter y el prisionero de Azkaban  Harry Potter y el cáliz de fuego  Harry Potter y la Orden del
1,aaaaaah,—¡AAAAAAAAAAAAAH.
1,dobles,—Pociones Dobles con los de Slytherin —respondió Ron—.
1,ininterrumpido,"Harry lo cerró de golpe, pero el aullido continuaba, en una nota aguda, ininterrumpida."
1,ópera,"Se ha hablado mucho de la Piedra Filosofal a lo largo de los siglos, pero la única Piedra que existe actualmente pertenece al señor Nicolás Flamel, el notable alquimista y amante de la ópera."
1,terminante,—No —dijo Harry en tono terminante—; ya hemos investigado demasiado.
1,estrangular él,"Por lo que Harry había visto, la serpiente no había hecho más que darles un golpe juguetón en los pies, pero cuando volvieron al asiento trasero del coche de tío Vernon, Dudley les contó que casi lo había mordido en la pierna, mientras Piers juraba q"
1,quédatir,quédate.
1,contentar él,"Ella y tío Vernon se acostaron en una cama llena de bultos en la habitación contigua, y Harry tuvo que contentarse con el trozo de suelo más blando que pudo encontrar y se hizo un ovillo bajo la manta más delgada y andrajosa."
1,rubí,"Harry observó al duende que tenía a la derecha, que pesaba unos rubíes tan grandes como brasas."
1,válgame,—Válgame Dios —susurró el cantinero—.
1,atragantar,Luego se atragantó y dijo:  —¡Ay de mí.
1,espectacularmente,"Allí, Harry estrenó su nuevo ajedrez y perdió espectacularmente contra Ron."
1,pegamento,Estaba cubierta por lo que parecía un pegamento gris grumoso.
1,confiscar,"Sin embargo, la señora Pomfrey consideró que no era muy higiénico y lo confiscó."
1,bonete,"En la mesa de los profesores, Dumbledore había reemplazado su sombrero cónico de mago por un bonete floreado, y se reía de un chiste del profesor Flitwick."
1,enfadar yo,"—No debería enfadarme —dijo con pesar—, pero a lo mejor no ha funcionado."
1,bombacho,"Los muchachos de Smeltings llevaban frac granate, pantalones bombachos de color naranja y sombrero de paja, rígido y plano, llamado canotié."
1,nombrar,"Después de todo, El-que-no-debe-ser-nombrado hizo grandes cosas."
1,visitar yo,Creo que lo mejor será hacerlo con unos amigos que vienen a visitarme la semana que viene.
1,regocijo,—dijo Filch con regocijo—.
1,burlonamente,Malfoy sonrió burlonamente a Crabbe y Goyle.
1,olfateir,"—Olfatea por ahí, mi tesoro."
1,entrometido,Harry no podía creer que alguien fuera tan entrometido.
1,triplicar,Había triplicado su tamaño en sólo una semana.
1,encarnado,"Harry miró el rostro encarnado de su tío y la cara pálida de su tía, que trataba de levantar a Dudley del suelo."
1,argumentar,"Apareció la señora Pomfrey y los hizo salir, argumentando que Ron necesitaba dormir."
1,sonreir él,"Y allí estaban su madre y su padre, sonriéndole otra vez, y uno de sus abuelos lo saludaba muy contento."
1,mentiroso,—¡MENTIRoso.
1,monstruosidad,Yo era la única que la veía tal como era: ¡una monstruosidad.
1,arce,—Arce y pluma de fénix.
1,derrotado,"En el momento en que se abrió la cerradura, la llave salió volando otra vez, con aspecto de derrotada, pues ya la habían atrapado dos veces."
1,tientas,"Resbalando y a tientas, siguieron a Hagrid por lo que parecía un empinado y estrecho sendero."
1,miraos,¡Miraos.
1,rebelión,"Él, Ron y Hermione se quedaban juntos, trabajando hasta altas horas de la noche, tratando de recordar los ingredientes de complicadas pociones, aprendiendo de memoria hechizos y encantamientos y repitiendo las fechas de descubrimientos mágicos y rebe"
1,astrólogo,Son unos malditos astrólogos.
1,abatimiento,"—Oh, sí —dijo el señor Dursley, con una espantosa sensación de abatimiento—."
1,desagradar,"Si había algo que desagradaba a los Dursley aún más que las preguntas que Harry hacía, era que hablara de cualquier cosa que no se desarrollara de la forma adecuada, ya fuera un sueño o un dibujo animado; parecían pensar que podía llegar a tener idea"
1,anotación,"Después de hacer una cantidad de complicadas anotaciones, les dio a cada uno una cerilla para que intentaran convertirla en una aguja."
1,internar él,"Anduvieron cerca de media hora, internándose cada vez más profundamente, hasta que el sendero se volvió casi imposible de seguir, porque los árboles eran muy gruesos."
1,estruendoso,"Harry quería seguir discutiendo, pero un eructo estruendoso y prolongado de Dudley, el hijo de los Dursley, ahogó sus palabras."
1,deseós,"Parecía que la profesora McGonagall había llegado al punto que más deseosa estaba por discutir, la verdadera razón por la que había esperado todo el día en una fría tapia, pues, ni como gato ni como mujer, había mirado nunca a Dumbledore con tal inte"
1,insolación,Ron se puso tan colorado que parecía un rábano con insolación.
1,guijarro,"Fueron por un túnel oscuro que parecía conducirlos justo por debajo del castillo, hasta que llegaron a una especie de muelle subterráneo, donde treparon entre las rocas y los guijarros."
1,dejar tú,"—Oh, vamos, ¿no pensarás que vamos a dejarte ir solo."
1,desilusionado,Estoy muy desilusionada por tu conducta.
1,canario,Hagrid ocupó dos asientos y comenzó a tejer lo que parecía una carpa de circo color amarillo canario.
1,ordinario,"Aunque Hagrid parecía saber adónde iban, era evidente que no estaba acostumbrado a hacerlo de la forma ordinaria."
1,divertir yo,Voy a divertirme mucho este verano con Dudley.
1,reverencial,—Es una capa invisible —dijo Ron con una expresión de temor reverencial—.
1,astillado,"En algunas partes estaba astillada y, en la punta, brillaba algo blanco."
1,contonear él,"Dudley se acercó contoneándose, lo más rápido que pudo."
1,mojar,"—dijo Harry, impresionado al ver la pena y el remordimiento de Hagrid, y las lágrimas que mojaban su barba—."
1,conjuro,—Estoy pensando cuál sería el mejor conjuro para prenderle fuego —dijo Harry.
1,controlar él,"El Barón Sanguinario es el único que puede controlarlo, ni siquiera nos escucha a los prefectos."
1,chisporroteant,"Muy pronto, la cabaña estaba llena del aroma de las salchichas chisporroteantes."
1,desplazamiento,El último día de agosto pensó que era mejor hablar con sus tíos sobre el desplazamiento a la estación de King’s Cross al día siguiente.
1,semanal,"Las clases de Pociones se convirtieron en torturas semanales para Harry, por la forma en que lo trataba Snape."
1,ma,"Para Jessica, a quien le gustan las historias,  para Anne, a quien también le gustaban,  y para Di, que oyó ésta primero      ÍNDICE   Capítulo 1 El niño que sobrevivió  Capítulo 2 El vidrio que se desvaneció  Capítulo 3 Las cartas de nadie  Capítulo"
1,dolorido,"«Tendrían que ver ahora al famoso Harry Potter», pensaba sin compasión, echando abono a los arriates, con la espalda dolorida y el sudor goteándole por la cara."
1,musculoso,En sus enormes brazos musculosos sostenía un bulto envuelto en mantas.
1,malherido,Hay por aquí un unicornio que ha sido malherido por alguien.
1,avisar yo,"Creo que, al menos, debió avisarnos a nosotros, los prefectos."
1,vindictus,"Hagrid casi tuvo que arrastrar a Harry para que dejara Hechizos y contrahechizos (encante a sus amigos y confunda a sus enemigos con las más recientes venganzas: Pérdida de Cabello, Piernas de Mantequilla, Lengua Atada y más, mucho más), del profesor"
1,da yo él,Dámelo.
1,quedarir,"Pensaste que si se equivocaba quedarías bien, ¿no es cierto."
1,llameante,"La que hablaba era una mujer regordeta que se dirigía a cuatro muchachos, todos con pelo de un llameante color rojo."
1,drag,Dicen que hay dragones custodiando las cámaras de máxima seguridad.
1,desprender él,"Crabbe y Malfoy retrocedieron mientras Goyle agitaba la mano para desprenderse de la rata, gritando de dolor, hasta que, finalmente, Scabbers salió volando, chocó contra la ventanilla y los tres muchachos desaparecieron."
1,espuma,La espuma de las altas olas chocaba contra las paredes de la cabaña y el feroz viento golpeaba contra los vidrios de las ventanas.
1,empinado,"Resbalando y a tientas, siguieron a Hagrid por lo que parecía un empinado y estrecho sendero."
1,murierir,Pero nunca quiso que murieras.
1,circo,Hagrid ocupó dos asientos y comenzó a tejer lo que parecía una carpa de circo color amarillo canario.
1,monótonamente,"Binns hablaba monótonamente, mientras escribía nombres y fechas, y confundía Emerico el Malvado con Ulrico el Chiflado."
1,graciass,"Graciasss, amigo."
1,enmarañado,Detrás de la barba enmarañada y las espesas cejas había una sonrisa muy bondadosa.
1,azotea,Habían dejado la capa invisible en la azotea de la torre.
1,admirado,"Empujó su escoba un poquito más, para volar más alto, y oyó los gritos y gemidos de las chicas que lo miraban desde abajo, y una exclamación admirada de Ron."
1,desgranar,"Hagrid estaba sentado en un sillón, fuera de la casa, con los pantalones y las mangas de la camisa arremangados, y desgranaba guisantes en un gran recipiente."
1,págalar,—Págale —gruñó Hagrid desde el sofá.
1,cuellecito,"Malitos, malitos, os agarrarán del cuellecito."
1,justificar,"Por supuesto que en Crabbe y Goyle no había nada que justificara el diminutivo, pero como la mesa de los profesores estaba llena, no podían hacer más que crujir los nudillos y mirarlo con el ceño fruncido."
1,majadero,"—Bah, cierra la boca, Dursley, grandísimo majadero —dijo el gigante."
1,llamar yo,—Llámame Hagrid —contestó—.
1,habrer,"—Perdón —dijo—, ¿por casualidad no habréis visto un sapo."
1,sortear él,"—Tal vez Snape ha descubierto cómo sortearlo sin preguntarle a Hagrid —dijo Ron, mirando los miles de libros que los rodeaban—."
1,carcaj,"Casi antes de que pudieran marcharse, Malfoy ya estaba riéndose a carcajadas."
1,alquilar,"El bote que tío Vernon había alquilado todavía estaba allí, con el fondo lleno de agua después de la tormenta."
1,ampolla,"Harry vio que estaban quemadas, en carne viva, con ampollas rojas y brillantes."
1,bienvenida,"—En el salón —respondió enseguida tía Petunia—, esperando para darles la bienvenida a nuestra casa."
1,erizar,A Harry se le erizaron los pelos de la nuca.
1,adorable,—¡Les va a parecer adorable.
1,inverosímil,"—repitió la profesora, como si pensara que era algo inverosímil—."
1,escalofrío,"La lámpara parecía flotar sola en el aire y hasta al mismo Harry, que sentía su brazo llevándola, la visión le dio escalofríos."
1,montar él,"Luego, la señora Hooch les enseñó cómo montarse en la escoba sin deslizarse hasta la punta, y recorrió la fila, corrigiéndoles la forma de sujetarla."
1,escribir tú,—¿Quién va a escribirte a ti.
1,alborotar,Una suave brisa les alborotó el cabello mientras miraban en dirección al bosque.
1,vergüenza,¿No te da vergüenza.
1,concen,"Si no lo hubiera hecho así, aquella mañana le habría costado concentrarse en los taladros."
1,vitrina,Las vitrinas con trofeos brillaban cuando las iluminaba la luz de la luna.
1,toscamente,"» Contenía una flauta de madera, toscamente trabajada."
1,picadora,"Mientras tío Vernon llamaba a la estafeta y a la lechería, tratando de encontrar a alguien para quejarse, tía Petunia trituraba las cartas en la picadora."
1,díctamo,"Harry, que estaba buscando «díctamo» en Mil hierbas mágicas y hongos, no levantó la cabeza hasta que oyó que Ron decía:  —¡Hagrid."
1,nam,"Rowling 1997  Copyright de la edición en castellano © Ediciones Salamandra 1999  Ilustración de cubierta: Olly Moss © Pottermore Limited 2015  Harry Potter characters, names and related indicia are trademarks of and © Warner Bros."
1,pomposamente,"—Bien hecho, Ron, excelente —dijo pomposamente Percy Weasley, por encima de Harry, mientras Zabini, Blaise, era seleccionado para Slytherin."
1,distribuido,"Guirnaldas de muérdago y acebo colgaban de las paredes, y no menos de doce árboles de Navidad estaban distribuidos por el lugar, algunos brillando con pequeños carámbanos, otros con cientos de velas."
1,autillo,"Mientras los búhos volaban por el Gran Comedor, como de costumbre, la atención de todos se fijó de inmediato en un paquete largo y delgado que llevaban seis grandes autillos."
1,venenosa,Dudley y Piers querían ver las gigantescas cobras venenosas y las gruesas pitones que estrujaban a los hombres.
1,deform,"Todavía brillaban algunas brasas en la chimenea, haciendo que todos los sillones parecieran deformes sombras negras."
1,coraje,"Hay que tener un gran coraje para oponerse a nuestros enemigos, pero hace falta el mismo valor para hacerlo con los amigos."
1,casilla,"muévete en diagonal, cuatro casillas a la derecha."
1,asomado,"Los primeros vagones ya estaban repletos de estudiantes, algunos asomados por las ventanillas para hablar con sus familiares, otros discutiendo sobre los asientos que iban a ocupar."
1,arreglar él,¿Cómo podrían arreglarlo.
1,inmediación,"Añoraba el castillo, con sus pasadizos secretos y sus fantasmas; las clases (aunque quizá no a Snape, el profesor de Pociones); los búhos que llevaban el correo; los banquetes en el Gran Comedor; dormir en su cama con dosel en el dormitorio de la tor"
1,fijar él,"—Mantenerse alejado de los problemas ya es algo —dijo Hagrid, cogiendo sus binoculares y fijándolos en la manchita que era Harry."
1,vaticinado,¡Los centauros debemos ocuparnos de lo que está vaticinado.
1,adusto,Hagrid lo miró con aire adusto.
1,redoma,1 juego de redomas de vidrio o cristal.
1,estrellado,"Encaramado en la cima de una alta montaña, al otro lado, con sus ventanas brillando bajo el cielo estrellado, había un impresionante castillo con muchas torres y torreones."
1,grageas,"En cambio, tenía Grageas Bertie Bott de Todos los Sabores, chicles, ranas de chocolate, empanada de calabaza, pasteles en forma de caldero, varitas de regaliz y otra cantidad de cosas extrañas que Harry no había visto en su vida."
1,decorar,no pueden estar aquí sólo para decorar —dijo Hermione.
1,disparar yo,¿Ibas a dispararme.
1,consumir,"Hay hombres que se han consumido ante esto, fascinados por lo que han visto."
1,flojo,"Estos fantásticos petardos no tenían nada que ver con los flojos artículos de los muggles, que Dudley habitualmente compraba, ni con juguetitos de plástico ni gorritos de papel."
1,cuánta,¿Cuántas veces se habían quejado de lo que les costaba mantener a Harry.
1,estrafalario,"Una anciana con aspecto estrafalario, toda vestida de verde, también lo había saludado alegremente en un autobús."
1,noveno,"El señor Dursley siempre se sentaba de espaldas a la ventana, en su oficina del noveno piso."
1,woodcroft,"Muy pronto tuvo no sólo a Dumbledore y Morgana, sino también a Hengist of Woodcroft, a Alberic Grunnion, Circe, Paracelso y Merlín."
1,corregir él,"Luego, la señora Hooch les enseñó cómo montarse en la escoba sin deslizarse hasta la punta, y recorrió la fila, corrigiéndoles la forma de sujetarla."
1,serpenteant,"Habían desaparecido los campos cultivados y aparecían bosques, ríos serpenteantes y colinas de color verde oscuro."
1,remendada,"Dudley se rió como un tonto, burlándose de Harry, que pasó la noche sin dormir imaginando lo que sucedería en el colegio al día siguiente, donde ya se reían de su ropa holgada y sus gafas remendadas."
1,esperanzado,—Podéis dejarme aquí —sugirió esperanzado Harry.
1,obrar,"—Estoy seguro de que Firenze pensó que estaba obrando de la mejor manera posible —dijo, con voz sombría."
1,hogueras,Tal vez la gente ha comenzado a celebrar antes de tiempo la Noche de las Hogueras.
1,brutalidad,—preguntó tío Vernon a Harry con brutalidad.
1,divertir él,"Por alguna razón, ver al gato pareció divertirlo."
1,fijeza,"Estaba muy ocupado revolviendo en su capa, buscando algo, pero pareció darse cuenta de que lo observaban porque, de pronto, miró al gato, que todavía lo contemplaba con fijeza desde la otra punta de la calle."
1,carretada,"Había estado en la cabaña de Hagrid, ayudándolo a alimentar a Norberto, que por entonces comía carretadas de ratas muertas."
1,sonriéndole,"Sonriéndole y saludándolo desde cada página, estaban su madre y su padre."
1,arrasar,"Sin ti, nos arrasó Ravenclaw, pero la comida será buena."
1,forzar yo,Mi tío abuelo Algie trataba de pillarme desprevenido y forzarme a que saliera algo de magia de mí.
1,tormentoso,"Los pocos búhos que habían podido llegar a través del cielo tormentoso para dejar el correo tuvieron que quedar al cuidado de Hagrid hasta recuperarse, antes de volar otra vez."
1,sacado,"Un bezoar es una piedra sacada del estómago de una cabra, y sirve para salvarte de la mayor parte de los venenos."
1,cambiar él,"Mientras tanto, en los vestuarios, Harry y el resto del equipo estaban cambiándose para ponerse las túnicas color escarlata de quidditch (Slytherin jugaría de verde)."
1,tonterías,"Tonterías, en mi opinión."
1,abrasar,El sol ardiente le abrasaba la nuca.
1,señalar él,"Luego paseó de un lado al otro de la fila de botellas, murmurando y señalándolas."
1,rasta,Un muchacho con rastas estaba rodeado por un grupo.
1,osadía,"Su osadía, temple y caballerosidad  distinguen a los de Gryffindor."
1,bullir,Las tribunas bullían.
1,phyllida,"— Mil hierbas y hongos mágicos, Phyllida Spore."
