1,telespectador,"Telespectadores de lugares tan apartados como Kent, Yorkshire y Dundee han telefoneado para decirme que, en lugar de la lluvia que prometí ayer, ¡ha caído un chaparrón de estrellas fugaces."
1,hervidor,"El gigante volvió a sentarse en el sofá, que se hundió bajo su peso, y comenzó a sacar toda clase de cosas de los bolsillos de su abrigo: un hervidor de cobre, un paquete de salchichas, un atizador, una tetera, varias tazas agrietadas y una botella d"
1,elegante,"Puedes tener bombines negros,  sombreros de copa altos y elegantes."
1,blandear,Hagrid empuñó su paraguas y lo blandió sobre su cabeza.
1,afecto,"Hagrid miró a Harry con afecto y respeto brillando en sus ojos, pero Harry, en lugar de sentirse complacido y orgulloso, estaba casi seguro de que había una terrible equivocación."
1,apasionante,Fue una de esas raras ocasiones en que la verdadera historia era aún más extraña y apasionante que los más extraños rumores.
1,sequedad,—preguntó con sequedad.
1,contar yo,"—Oh, vamos, Hagrid, puedes no querer contarnos nada, pero debes saberlo, tú sabes todo lo que sucede por aquí —dijo Hermione con voz afectuosa y lisonjera."
1,ensangrentado,"—dijo, enseñándoles la mano envuelta en un pañuelo ensangrentado—."
1,francamente,francamente.
1,endeble,"Era un lugar pequeño y vacío, salvo por una silla endeble donde Hagrid se sentó a esperar."
1,corretear,"—Hagrid —dijo Harry, jadeando un poco mientras correteaba para seguirlo—, ¿no dijiste que había dragones en Gringotts."
1,bros,"Rowling 1997  Copyright de la edición en castellano © Ediciones Salamandra 1999  Ilustración de cubierta: Olly Moss © Pottermore Limited 2015  Harry Potter characters, names and related indicia are trademarks of and © Warner Bros."
1,enviadme,"Si encontráis algo, enviadme un búho."
1,espasmo,"Por primera vez, un espasmo de miedo cruzó el rostro de Quirrell."
1,warner,"Rowling 1997  Copyright de la edición en castellano © Ediciones Salamandra 1999  Ilustración de cubierta: Olly Moss © Pottermore Limited 2015  Harry Potter characters, names and related indicia are trademarks of and © Warner Bros."
1,amiguito,—Eres mucho más valiente ahora que has vuelto a tierra firme y tienes a tus amiguitos —dijo fríamente Harry.
1,redacción,"—¿Qué tal: «En el colegio nos han mandado escribir una redacción sobre nuestro héroe preferido, señor Mason, y yo la he hecho sobre usted»."
1,encorvado,"Llevaba gafas de media luna, tenía la nariz larga y encorvada, cabello plateado suelto, barba y bigote."
1,campanilla,"Cuando entraron, una campanilla resonó en el fondo de la tienda."
1,diga yo,"Dígame dónde ha comprado ese vestido, señora Mason."
1,tocar yo,—¿Y por qué Quirrell no podía tocarme.
1,engordar,"—Ese gordo pastel que es su hijo no necesita engordar más, Dursley, no se preocupe."
1,paliza,"—Ahora escucha esto, chico —gruñó—: acepto que hay algo extraño en ti, probablemente nada que no hubiera curado una buena paliza."
1,inscripción,Tenía una inscripción grabada en la parte superior: Oesed lenoz aro cut edon isara cut se onotse.
1,morada,¡Esto es allanamiento de morada.
1,enterrar,Hermione enterró la cara entre los brazos.
1,pasaréis,"Tendréis clases con el resto de la casa que os toque, dormiréis en el dormitorio de vuestra casa y pasaréis el tiempo libre en la sala común de la casa."
1,locutor,—El locutor se permitió una mueca irónica—.
1,anne,"Para Jessica, a quien le gustan las historias,  para Anne, a quien también le gustaban,  y para Di, que oyó ésta primero      ÍNDICE   Capítulo 1 El niño que sobrevivió  Capítulo 2 El vidrio que se desvaneció  Capítulo 3 Las cartas de nadie  Capítulo"
1,celoso,"Así que Malfoy, celoso y enfadado, había vuelto a meterse con Harry por no tener una familia apropiada."
1,desventaja,"Sin embargo, las piezas de ajedrez viejas no eran una desventaja."
1,floreado,"En la mesa de los profesores, Dumbledore había reemplazado su sombrero cónico de mago por un bonete floreado, y se reía de un chiste del profesor Flitwick."
1,unísono,—dijeron al unísono.
1,alquiler,"Queda rigurosamenta prohibida, sin la autorización de los titulares del “Copyright”, bajo las sanciones establecidas en las leyes, la reproducción parcial o total de esta obra por cualquier medio o procedimiento, incluidos la reprografía y el tratami"
1,alquimista,"Se ha hablado mucho de la Piedra Filosofal a lo largo de los siglos, pero la única Piedra que existe actualmente pertenece al señor Nicolás Flamel, el notable alquimista y amante de la ópera."
1,desdén,"—El profesor Dumbledore dice que tienes permiso para ir —dijo con desdén, como si considerara que el profesor Dumbledore no se daba cuenta de lo peligrosas que eran las fiestas—."
1,lenoz,Tenía una inscripción grabada en la parte superior: Oesed lenoz aro cut edon isara cut se onotse.
1,personalmente,"—Ten cuidado, Potter, otra noche de vagabundeos y yo personalmente me encargaré de que te expulsen."
1,amoratado,"Observó a Harry con cuidado, fijando la mirada en la cicatriz, que se veía amoratada en la frente de Harry."
1,pichoncito,"¿Qué te parece, pichoncito."
1,casualmente,"—¿No os parece un poco raro —dijo Harry, subiendo por la colina cubierta de hierba— que lo que más deseara Hagrid fuera un dragón, y que de pronto aparezca un desconocido que casualmente lleva un huevo en el bolsillo."
1,baruffio,"Y pronunciar las palabras mágicas correctamente es muy importante también, no os olvidéis nunca del mago Baruffio, que dijo «ese» en lugar de «efe» y se encontró tirado en el suelo con un búfalo en el pecho."
1,desconcierto,Dumbledore sonrió ante la expresión de desconcierto que se veía en el rostro de Harry.
1,escándalo,¡Un escándalo.
1,canto,Harry sopló y la flauta emitió un sonido parecido al canto del búho.
1,trozos,Harry estaba muy silencioso mientras comía el helado que Hagrid le había comprado (chocolate y frambuesa con trozos de nueces).
1,sorbo,El gigante tomó un sorbo de té y se secó la boca con el dorso de la mano.
1,matinal,—bramó como saludo matinal.
1,adormecer él,"El señor Dursley cayó en un sueño intranquilo, pero el gato que estaba sentado en la pared del jardín no mostraba señales de adormecerse."
1,abatido,"Abatido, fijó la vista en el seto."
1,huir,Malfoy dejó escapar un terrible grito y huyó.
1,opinar,"Éste le propinó a Harry una palmada en el brazo, dándole la horrible sensación de haberlo metido en un cubo de agua helada."
1,judía,"Harry encontró tostadas, coco, judías cocidas, fresa, curry, hierbas, café y sardinas, y fue lo bastante valiente para morder la punta de una gris, que Ron no quiso tocar y resultó ser pimienta."
1,tapia,"Parecía que la profesora McGonagall había llegado al punto que más deseosa estaba por discutir, la verdadera razón por la que había esperado todo el día en una fría tapia, pues, ni como gato ni como mujer, había mirado nunca a Dumbledore con tal inte"
1,goshawk,")    LIBROS  Todos los alumnos deben tener un ejemplar de los siguientes libros:  — Libro reglamentario de hechizos, primer curso, Miranda Goshawk."
1,rebotar,Pero yo reboté por el jardín hasta llegar a la calle.
1,cordel,"El abrigo de Hagrid parecía hecho sólo de bolsillos, con contenidos de todo tipo: manojos de llaves, veneno para babosas, ovillos de cordel, caramelos de menta, bolsitas de té."
1,sigilosamente,Una figura encapuchada bajó sigilosamente la escalera principal del castillo.
1,jerez,"Unas ancianas estaban sentadas en un rincón, tomando copitas de jerez."
1,vendado,"Encontraron a Fang, el gran danés, sentado fuera, con la cola vendada, cuando fueron a avisar a Hagrid."
1,oveja,Ahora circulaban veloces por campos llenos de vacas y ovejas.
1,suceso,"Su último y consolador pensamiento antes de quedarse dormido fue que, aunque los Potter estuvieran implicados en los sucesos, no había razón para que se acercaran a él y a la señora Dursley."
1,acarrear,CAPÍTULO 3   Las cartas de nadie   La fuga de la boa constrictor le acarreó a Harry el castigo más largo de su vida.
1,puntiaguda,"Sus alas puntiagudas eran enormes, comparadas con el cuerpo flacucho."
1,manecilla,Tenía doce manecillas y ningún número; pequeños planetas se movían por el perímetro del círculo.
1,intacto,"Como Dudley y el seto estaban intactos, tía Petunia sabía que Harry no había hecho magia en realidad, pero aun así intentó pegarle en la cabeza con la sartén que tenía a medio enjabonar y Harry tuvo que esquivar el golpe."
1,higiénico,"Sin embargo, la señora Pomfrey consideró que no era muy higiénico y lo confiscó."
1,collar,"Los dejó entrar, tirando del collar de un imponente gran danés negro."
1,colorada,"Harry, que no había desayunado, se levantó de un salto, pero las orejas de Ron se pusieron otra vez coloradas y murmuró que había llevado bocadillos."
1,víspera,"»  En la víspera de Navidad, Harry se fue a la cama deseoso de que llegara el día siguiente, pensando en la diversión y comida que lo aguardaban, pero sin esperar ningún regalo."
1,bajito,"Un hombre bajito que llevaba un sombrero de copa hablaba con el viejo cantinero, que era completamente calvo y parecía una nuez blanda."
1,huella,Ahora vamos a dividirnos en dos equipos y seguiremos las huellas en distintas direcciones.
1,automáticos,"«Calderos – Todos los Tamaños – Latón, Cobre, Peltre, Plata – Automáticos – Plegables», decía un rótulo que colgaba sobre ellos."
1,agonía,Era una agonía el tocar a una persona marcada por algo tan bueno.
1,zaino,"De la cintura para arriba, un hombre, con pelo y barba rojizos, pero por debajo, el cuerpo de pelaje zaino de un caballo, con una cola larga y rojiza."
1,allanamiento,¡Esto es allanamiento de morada.
1,asimilar él,"¿No se da cuenta de que será mucho mejor que crezca lejos de todo, hasta que esté preparado para asimilarlo."
1,orificio,"La atroz criatura no se daba cuenta de que Harry colgaba de su espalda, pero hasta un ser así podía sentirlo si uno le clavaba un palito de madera en la nariz, pues la varita de Harry todavía estaba en su mano cuando saltó y se había introducido dire"
1,crecido,"Tía Petunia estalló en lágrimas y dijo que no podía creer que aquél fuera su pequeño Dudley, tan apuesto y crecido."
1,caput,"—Caput draconis —dijo Percy, y el retrato se balanceó hacia delante y dejó ver un agujero redondo en la pared."
1,venda,Filch estaba alcanzándole unas vendas.
1,afligido,Parecía muy afligido.
1,contable,"Me parece que mamá tiene un primo segundo que es contable, pero nunca hablamos de él."
1,ge,"Para Jessica, a quien le gustan las historias,  para Anne, a quien también le gustaban,  y para Di, que oyó ésta primero      ÍNDICE   Capítulo 1 El niño que sobrevivió  Capítulo 2 El vidrio que se desvaneció  Capítulo 3 Las cartas de nadie  Capítulo"
1,siniestro,"En tono bajo, para que nadie más lo oyera, Harry les explicó el súbito y siniestro deseo de Snape de ser árbitro de quidditch."
1,ventanal,"Se deslizaron por pasillos iluminados por el claro de luna, que entraba por los altos ventanales."
1,conmovedor,—Qué conmovedor —dijo—.
1,suspicaz,La profesora lo miró entre impresionada y suspicaz.
1,tarántula,Lee Jordan tiene una tarántula gigante y vamos a verla.
1,resistir él,Ron no pudo resistirse.
1,evasivo,—Estaba mirando —dijo con una voz evasiva que les llamó la atención—.
1,bajío,Los gemelos Weasley y Lee Jordan se dedicaban a pinchar los tentáculos de un calamar gigante que tomaba el sol en los cálidos bajíos.
1,aaauuu,—¡AAAUUU.
1,parentesco,Le pareció que tenía cierto parentesco con el trol gigante.
1,perdone,"por supuesto que no, usted es invisible, perdone al viejo Peeves por su broma, señor."
1,metepatas,"Pobre metepatas Neville, Harry sabía lo que debía de haberle costado buscarlos en la oscuridad para prevenirlos."
1,trigo,Al día siguiente desayunaron copos de trigo rancios y tomates de lata fríos sobre tostadas.
1,bondadosamente,"—preguntó bondadosamente, y Harry asintió con la cabeza."
1,equilibrar él,"Lo sacó con dificultad, porque era muy pesado, y, equilibrándolo sobre sus rodillas, lo abrió."
1,cuidar él,No puede cuidarlo.
1,reconfortado,"»)  Harry, que comenzaba a sentirse reconfortado y soñoliento, miró otra vez hacia la mesa de los profesores."
1,disparate,—Una sarta de disparates —dijo tío Vernon.
1,calloso,"Tenía piernas cortas, gruesas como troncos de árbol, y pies planos y callosos."
1,aburrimiento,"Si él hubiera estado allí dentro, sin duda se habría muerto de aburrimiento, sin ninguna compañía, salvo la de gente estúpida golpeando el vidrio y molestando todo el día."
1,agradecimiento,"Su turbante, les dijo, era un regalo de un príncipe africano como agradecimiento por haberlo liberado de un molesto zombi, pero ninguno creía demasiado en su historia."
1,howard,"Howard, ¿no."
1,entraña,Harry sintió como si se le helaran las entrañas.
1,chipolata,"Un centenar de gordos pavos asados, montañas de patatas cocidas y asadas, fuentes de grasientas salchichas chipolatas, soperas llenas de guisantes con mantequilla, recipientes de plata con una espesa y rica salsa de carne y moras, y muchos petardos s"
1,deleite,La expresión de intriga de Wood se convirtió en deleite.
1,tom,"—No puedo, Tom, estoy aquí por asuntos de Hogwarts —respondió él, poniendo una mano en el hombro de Harry y obligándolo a doblar las rodillas."
1,lamer él,"—Estáis en vuestra casa —dijo Hagrid, soltando a Fang, que se lanzó contra Ron y comenzó a lamerle las orejas."
1,admiración,"—Sé que usted no tiene ese problema —observó la profesora McGonagall, entre la exasperación y la admiración—."
1,flanco,"Ronan y Bane aparecieron velozmente entre los árboles, resoplando y con los flancos sudados."
1,sardina,"Harry encontró tostadas, coco, judías cocidas, fresa, curry, hierbas, café y sardinas, y fue lo bastante valiente para morder la punta de una gris, que Ron no quiso tocar y resultó ser pimienta."
1,terminar él,"Comieron en el restaurante del zoológico, y cuando Dudley tuvo una rabieta porque su bocadillo no era lo suficientemente grande, tío Vernon le compró otro y Harry tuvo permiso para terminarse el primero."
1,celo,"—Es una escoba —dijo, devolviéndoselo bruscamente, con una mezcla de celos y rencor en la cara—."
1,furtivo,"Harry asintió, pero no pudo evitar la furtiva sensación de que se había olvidado de hacer algo, algo importante."
1,morirías,"Te morirías de hambre tratando de salir, aunque hubieras podido robar algo."
1,sanción,"Queda rigurosamenta prohibida, sin la autorización de los titulares del “Copyright”, bajo las sanciones establecidas en las leyes, la reproducción parcial o total de esta obra por cualquier medio o procedimiento, incluidos la reprografía y el tratami"
1,desgarrador,"Un grito desgarrador, espantoso, cortó el silencio."
1,lateír,Su corazón latió más rápido que nunca.
1,enjabonar,"Como Dudley y el seto estaban intactos, tía Petunia sabía que Harry no había hecho magia en realidad, pero aun así intentó pegarle en la cabeza con la sartén que tenía a medio enjabonar y Harry tuvo que esquivar el golpe."
1,sna,"No es raro que parezca tan nervioso, ése es el profesor Snape."
1,ébano,"Ébano y pelo de unicornio, veintiún centímetros y medio."
1,escocir,"A Harry le escocían los ojos por las ráfagas de aire frío, pero los mantuvo muy abiertos."
1,descubrir yo,"—Sí, sí, es todo muy triste, pero domínate, Hagrid, o van a descubrirnos —susurró la profesora McGonagall, dando una palmada en un brazo de Hagrid, mientras Dumbledore pasaba sobre la verja del jardín e iba hasta la puerta que había enfrente."
1,domesticar,"De todos modos, no se puede domesticar un dragón, es peligroso."
1,vivacidad,"Sin embargo, todavía tengo los pedazos —añadió con vivacidad."
1,rowling,"Rowling 1997  Copyright de la edición en castellano © Ediciones Salamandra 1999  Ilustración de cubierta: Olly Moss © Pottermore Limited 2015  Harry Potter characters, names and related indicia are trademarks of and © Warner Bros."
1,decena,"Y además, por supuesto, estaba el gran tamaño de la biblioteca, decenas de miles de libros, miles de estantes, cientos de estrechas filas."
1,fluido,Algo fluido y de color gris plateado se deslizó hacia el suelo y se quedó brillando.
1,impopular,"Todos los otros profesores creyeron que Snape trataba de impedir que Gryffindor ganase, se ha hecho muy impopular."
1,baratija,¡Baratijas.
1,parquímetro,"Los transeúntes miraban mucho a Hagrid mientras recorrían el pueblecito camino de la estación, y Harry no podía reprochárselo: Hagrid no sólo era el doble de alto que cualquiera, sino que señalaba cosas totalmente corrientes, como los parquímetros, d"
1,tentáculo,Los gemelos Weasley y Lee Jordan se dedicaban a pinchar los tentáculos de un calamar gigante que tomaba el sol en los cálidos bajíos.
1,joya,"Algo realmente extraordinario tenía que haber en aquella cámara de máxima seguridad, Harry estaba seguro, y se inclinó anhelante, esperando ver por lo menos joyas fabulosas, pero la primera impresión era que estaba vacía."
1,pillar yo,Mi tío abuelo Algie trataba de pillarme desprevenido y forzarme a que saliera algo de magia de mí.
1,paws,"Harry sabía que debería sentir pena por la pierna de la señora Figg, pero no era fácil cuando recordaba que pasaría un año antes de tener que ver otra vez a Tibbles, Snowy, el Señor Paws o Tufty."
1,spore,"— Mil hierbas y hongos mágicos, Phyllida Spore."
1,búfalo,"Y pronunciar las palabras mágicas correctamente es muy importante también, no os olvidéis nunca del mago Baruffio, que dijo «ese» en lugar de «efe» y se encontró tirado en el suelo con un búfalo en el pecho."
1,esperad,—¡Esperad aquí.
1,aplastada,Las plumas están aplastadas por un lado.
1,blotts,"Compraron los libros de Harry en una tienda llamada Flourish y Blotts, en donde los estantes estaban llenos de libros hasta el techo."
1,lluviós,Pero puedo prometerles una noche lluviosa para hoy.
1,expulsar tú,¡Van a expulsarte.
1,gustar tú,"Nunca pensé que podían gustarte los gorditos llorones, Parvati."
1,desesperación,"Con una última mirada de desesperación hacia Ron, Harry y Hermione corrieron hacia la salida y subieron por el siguiente pasadizo."
1,domínate,"—Sí, sí, es todo muy triste, pero domínate, Hagrid, o van a descubrirnos —susurró la profesora McGonagall, dando una palmada en un brazo de Hagrid, mientras Dumbledore pasaba sobre la verja del jardín e iba hasta la puerta que había enfrente."
1,lleve él,—Llévelo a la enfermería —ordenó Snape a Seamus.
1,abovedado,"Un segundo más tarde estaban contemplando un pasaje abovedado lo bastante grande hasta para Hagrid, un paso que llevaba a una calle con adoquines, que serpenteaba hasta quedar fuera de la vista."
1,apilado,"Estaba acostado en una cama, con sábanas blancas de hilo, y cerca había una mesa, con lo que parecía la mitad de la tienda de golosinas apilado en un montón."
1,ultraje,¡Eso es un ultraje.
1,tijera,"En una ocasión, tía Petunia, cansada de que Harry volviera de la peluquería como si no hubiera ido, cogió unas tijeras de la cocina y le cortó el pelo casi al rape, exceptuando el flequillo, que le dejó «para ocultar la horrible cicatriz»."
1,remontar él,"Cada uno cogió una escoba y de una patada estuvieron en el aire, remontándose entre la nube de llaves."
1,doler él,", eso ha tenido que dolerle, un golpe de bludger en la nuca."
1,azkaban,Títulos disponibles en la serie de Harry Potter (en orden de aparición):      Harry Potter y la piedra filosofal  Harry Potter y la cámara secreta  Harry Potter y el prisionero de Azkaban  Harry Potter y el cáliz de fuego  Harry Potter y la Orden del
1,sorna,—Hoy es tu cumpleaños —dijo con sorna—.
1,bombín,"Puedes tener bombines negros,  sombreros de copa altos y elegantes."
1,sangrante,"Con los ojos llorosos vieron, aplastado en el suelo frente a ellos, un trol más grande que el que habían derribado, inconsciente y con un bulto sangrante en la cabeza."
1,señalado,"Si Hagrid no lo hubiera señalado, Harry no habría reparado en él."
1,expuesto,"Movía la cabeza en todas direcciones mientras iban calle arriba, tratando de mirar todo al mismo tiempo: las tiendas, las cosas expuestas fuera y la gente haciendo compras."
1,exhausto,"Eran las siete de la tarde cuando finalmente, exhausto, oyó que lo llamaba tía Petunia."
1,comunicar yo,"—Bueno, yo volví —dijo Hermione—, reanimé a Ron (tardé un rato largo) y, cuando íbamos a la buhonera para comunicarnos con Dumbledore, lo encontramos en el vestíbulo de entrada."
1,j,"Para Jessica, a quien le gustan las historias,  para Anne, a quien también le gustaban,  y para Di, que oyó ésta primero      ÍNDICE   Capítulo 1 El niño que sobrevivió  Capítulo 2 El vidrio que se desvaneció  Capítulo 3 Las cartas de nadie  Capítulo"
1,apuesto,"Tía Petunia estalló en lágrimas y dijo que no podía creer que aquél fuera su pequeño Dudley, tan apuesto y crecido."
1,exclamación,"Empujó su escoba un poquito más, para volar más alto, y oyó los gritos y gemidos de las chicas que lo miraban desde abajo, y una exclamación admirada de Ron."
1,alquilar yo,¡Y este caballero ha aceptado gentilmente alquilarnos su bote.
1,azotar,"El mar congelado los salpicaba, la lluvia les golpeaba la cabeza y un viento gélido les azotaba el rostro."
1,flourish,"Compraron los libros de Harry en una tienda llamada Flourish y Blotts, en donde los estantes estaban llenos de libros hasta el techo."
1,destartalada,"En Hogwarts había 142 escaleras, algunas amplias y despejadas, otras estrechas y destartaladas."
1,cegadoro,"Mientras Hagrid iba terminando la historia, vio otra vez la cegadora luz verde, con más claridad de lo que la había recordado antes, y por primera vez en su vida se acordó de algo más, de una risa cruel, aguda y fría."
1,salido,Las personas que estaban en la casa de los reptiles gritaban y corrían hacia las salidas.
1,colorado,Ron se puso tan colorado que parecía un rábano con insolación.
1,feorge,Sabemos muy bien que nos llamamos Gred y Feorge.
1,descubridor,—Nicolás Flamel —susurró con tono teatral— es el único descubridor conocido de la Piedra Filosofal.
1,oleada,Una oleada de humo verde los envolvió.
1,suéltamar,"¡Suéltame, Neville."
1,amenazadoramente,"Harry trató de apartar al búho, pero éste cerró el pico amenazadoramente y continuó atacando el abrigo."
1,sumamente,Han estado sumamente preocupados.
1,sobresaliente,"La sala estaba mortalmente silenciosa— por todo su temple y sobresaliente valor, premio de sesenta puntos a la casa Gryffindor."
1,fugazmente,"Se quedaron un rato en silencio, viendo campos y caminos pasar fugazmente."
1,verrugas,"Cuando Harry finalmente se levantó de la mesa, estaba cargado de cosas salidas de los petardos, que incluían un paquete de globos luminosos que no estallaban, un kit de Haga Crecer Sus Propias Verrugas y piezas nuevas de ajedrez."
1,jefa,"La profesora McGonagall era la jefa de la casa Gryffindor, pero eso no le había impedido ponerles una gran cantidad de deberes el día anterior."
1,desprender,"Retorciéndose y alejándose, se desprendió de sus cuerpos y pudieron moverse."
1,arriesgar yo,Tendremos que arriesgarnos.
1,ventanita,"Como no podían echarlas en el buzón, las habían pasado por debajo de la puerta, empujado por las rendijas, y unas pocas por la ventanita del cuarto de baño de abajo."
1,escarcha,"Cada mañana, el parque aparecía cubierto de escarcha."
1,guardar él,"—Todavía no vamos a practicar con la snitch —dijo Wood, guardándola con cuidado en la caja—."
1,alargar,Alargó una mano para acariciar la cabeza del dragón.
1,despreocupación,"—Oh, éste es Crabbe y éste Goyle —dijo el muchacho pálido con despreocupación, al darse cuenta de que Harry los miraba—."
1,perseguido,"todas las cosas raras que habían hecho que sus tíos se enfadaran con él habían sucedido cuando él, Harry, estaba molesto o enfadado: perseguido por la banda de Dudley, de golpe se había encontrado fuera de su alcance; temeroso de ir al colegio con aq"
1,fangoso,"Entonces, durante un entrenamiento especialmente húmedo y fangoso, Wood les dio una mala noticia."
1,arborícola,"Disgustado por la derrota de Slytherin, había tratado de hacer que todos se rieran diciendo que una rana arborícola con la boca abierta podía reemplazar a Harry como buscador."
1,enseñar él él,"—Bien —contestó, enseñándosela—."
1,devolver yo,—Me preguntaba si podía devolverme mi libro —dijo.
1,contrabando,Creo que voy a fastidiar a mi padre hasta que me compre una y la meteré de contrabando de alguna manera.
1,cumplido,"Bien, deberíamos tener preparados algunos cumplidos para la cena."
1,chiquillada,He venido porque fuera están haciendo chiquilladas y corriendo por los pasillos —dijo Hermione en tono despectivo—.
1,asqueroso,"—Quiero decir, después de esta evidente y asquerosa falta."
1,adolfo,Título original: Harry Potter and the Philosopher’s Stone  Traducción: Alicia Dellepiane Rawson  Traducción del capítulo adicional: Adolfo Muñoz García y Nieves Martín Azofra  Esta edición digital ha sido publicada por primera vez por Pottermore Limi
1,irónico,—El locutor se permitió una mueca irónica—.
1,gotear él,"«Tendrían que ver ahora al famoso Harry Potter», pensaba sin compasión, echando abono a los arriates, con la espalda dolorida y el sudor goteándole por la cara."
1,constructor,"Un rico constructor y su esposa irían a cenar, y tío Vernon esperaba obtener un pedido descomunal."
